id,created_at,text - utf-8,simplified
1526795378913574912,2022-05-18 05:22:39+00:00,"b'i miss you so bad. ~2 years without you is so fuckin\xe2\x80\x99 hard. i might seem okay and doing fine.. but universe, hindi ko na ata kaya \xf0\x9f\x98\xad\xf0\x9f\x98\xad\xf0\x9f\x98\xad why does it hurt so much :((((((( https://t.co/13y9lfiO1p'",i miss you so bad 2 years without you is so fuckin hard i might seem okay and doing fine but universe hindi ko na ata kaya why does it hurt so much
1526795376300175360,2022-05-18 05:22:38+00:00,"b""Bwisit ang first time ko mameet mga co SMEs ko tapos lakas ng ulan, na traffic ako. hahaha laroshi talaga pero masaya naman nameet ko na sila and I'm happy for that""",Bwisit ang first time ko mameet mga co SMEs ko tapos lakas ng ulan na traffic ako hahaha laroshi talaga pero masaya naman nameet ko na sila and I m happy for that
1526795373251293184,2022-05-18 05:22:38+00:00,b'Good afternoon. \xf0\x9f\x92\xa6 https://t.co/UZjijB6uHK',Good afternoon
1526795349251489792,2022-05-18 05:22:32+00:00,"b'Canceled today\xe2\x80\x99s sessions. My back has been hurting. I probably need shoulder and chest release. If not, I blame the 3 cups of coffee everyday. :('",Canceled today s sessions My back has been hurting I probably need shoulder and chest release If not I blame the 3 cups of coffee everyday
1526795339189014528,2022-05-18 05:22:30+00:00,"b""Bakit walang lifeguard dito? \n\nAnyway, I don't need saving... charrr \xf0\x9f\x98\x82\xf0\x9f\x98\x82 @ Virgin Island, Bantayan, Cebu https://t.co/V3RHGteJqN""",Bakit walang lifeguard dito Anyway I don t need saving charrr Virgin Island Bantayan Cebu
1526795337817501696,2022-05-18 05:22:29+00:00,b'GALIT NA GALIT NA GALIT NA GALIT NA GALIT NA NAMAN AKO TANGINAAAAAAAAAAAAAAAA. juskopinas. https://t.co/bUfYwzEPpg',GALIT NA GALIT NA GALIT NA GALIT NA GALIT NA NAMAN AKO TANGINAAAAAAAAAAAAAAAA juskopinas
1526795329731203073,2022-05-18 05:22:27+00:00,b'Nakaka offend ung mga words \xf0\x9f\x91\x8e',Nakaka offend ung mga words
1526795312915894273,2022-05-18 05:22:23+00:00,b'@SUMMONTHEDIVINE Looks beautiful \xf0\x9f\x96\xa4',Looks beautiful
1526795312517394433,2022-05-18 05:22:23+00:00,b'Ang inet.',Ang inet
1526795306855067649,2022-05-18 05:22:22+00:00,b'Hot afternoon every Juan! https://t.co/zCrPyUp7Yf',Hot afternoon every Juan
1526795279084638208,2022-05-18 05:22:15+00:00,b'Inibanan man lang si mader\xf0\x9f\xa4\x9e\xf0\x9f\x98\x8c https://t.co/NiLuG9ChjH',Inibanan man lang si mader
1526795263318589440,2022-05-18 05:22:11+00:00,b'@dawgzdexplorer Hoooooy',Hoooooy
1526795259782389760,2022-05-18 05:22:11+00:00,b'napakabilis ma sold out! jusq',napakabilis ma sold out jusq
1526795228358668288,2022-05-18 05:22:03+00:00,"b'Before pa election, campaign era palang tpos ngayon niyo lng bibigyan pansin hahaha https://t.co/c7BBRAGy7a'",Before pa election campaign era palang tpos ngayon niyo lng bibigyan pansin hahaha
1526795222939602944,2022-05-18 05:22:02+00:00,b'Ay anong meron? Grabe angbinet. Tapos walang kuryente @meralco',Ay anong meron Grabe angbinet Tapos walang kuryente
1526795220465369088,2022-05-18 05:22:01+00:00,b'The entitlement of this New Generation is deafening\xe2\x80\xa6 https://t.co/sR0alnUv6W',The entitlement of this New Generation is deafening
1526795216543305728,2022-05-18 05:22:00+00:00,b'Goods na goods tong next pari ng Rosales \xf0\x9f\x92\x96',Goods na goods tong next pari ng Rosales
1526795211837685760,2022-05-18 05:21:59+00:00,b'@Ricajanearenas2 Ay be iba nasa isip mo HAHAHAHAHAHAHA',Ay be iba nasa isip mo HAHAHAHAHAHAHA
1526795209752752128,2022-05-18 05:21:59+00:00,b'0_1 https://t.co/FizmNm9Xq3',0 1
1526795195710590976,2022-05-18 05:21:55+00:00,b'nge lami manumbag karon HAHAHAHA yawa ely unsa naa sa imoha utok oy? Tarong pa ba ka',nge lami manumbag karon HAHAHAHA yawa ely unsa naa sa imoha utok oy Tarong pa ba ka
1526795176210944000,2022-05-18 05:21:51+00:00,b'one dot tapos sabihin ko kung anong klaseng  bading kayo chz https://t.co/mlaK3x2pZe',one dot tapos sabihin ko kung anong klaseng bading kayo chz
1526795150864752640,2022-05-18 05:21:45+00:00,b'@eyudmcruz_ I am the proudest!',I am the proudest
1526795125992849408,2022-05-18 05:21:39+00:00,b'You are the first thing that comes through my mind when the rain starts \xf0\x9f\xa5\xba',You are the first thing that comes through my mind when the rain starts
1526795123517841409,2022-05-18 05:21:38+00:00,b'Sheteeee naiwan pala yung vape ko sa marinduque \xf0\x9f\x98\xae\xe2\x80\x8d\xf0\x9f\x92\xa8',Sheteeee naiwan pala yung vape ko sa marinduque
1526795121445830656,2022-05-18 05:21:38+00:00,b'@jomarx0321 @Bluerain111111 Mo convert naka jom',Mo convert naka jom
1526795111744552961,2022-05-18 05:21:35+00:00,"b'Just posted a photo @ Iloilo City, Philippines https://t.co/vqBNJPszPU'",Just posted a photo Iloilo City Philippines
1526795110062891008,2022-05-18 05:21:35+00:00,b'@Bif_cake Mapamanicure?',cake Mapamanicure
1526795099341922305,2022-05-18 05:21:32+00:00,b'@cleaxxxmj Nagtinda nyan sila @KPOPmerchPHgo alam ko',Nagtinda nyan sila alam ko
1526795087317204992,2022-05-18 05:21:29+00:00,b'Otw to Qc.',Otw to Qc
1526795058233901057,2022-05-18 05:21:23+00:00,b'Empanada... https://t.co/JvdNoxfGot',Empanada
1526795045705482240,2022-05-18 05:21:20+00:00,b'wednesday pa pang may hugot na..heheh nice work to listen to https://t.co/kE7wwEBDnn',wednesday pa pang may hugot na heheh nice work to listen to
1526795044061335552,2022-05-18 05:21:19+00:00,b'@ZirEcho @boredpunksoc Thanksss boss eto ung namint ko eh\xe2\x9d\xa4',Thanksss boss eto ung namint ko eh
1526795043054702592,2022-05-18 05:21:19+00:00,b'@Jaks0896 @sntstrstn iba talaga mga nais. \xf0\x9f\x98\x82',iba talaga mga nais
1526795042400399360,2022-05-18 05:21:19+00:00,"b'Sakit ng mga mata ko, nasobrahan ata sa panunuod ng porn \xf0\x9f\xab\xa3\xf0\x9f\xa4\xad\xf0\x9f\x98\xa5'",Sakit ng mga mata ko nasobrahan ata sa panunuod ng porn
1526795014973837317,2022-05-18 05:21:12+00:00,b'blurred \xf0\x9f\x92\xa5 https://t.co/9p32Fcr1qf',blurred
1526795002591858688,2022-05-18 05:21:09+00:00,b'See u on May 29 5dream and renjun \xf0\x9f\x98\xad\xf0\x9f\xa4\xa7 https://t.co/6EEaFPEKUz',See u on May 29 5dream and renjun
1526794998171152384,2022-05-18 05:21:08+00:00,b'@kopibeanss Sana all may time magluto',Sana all may time magluto
1526794961965838341,2022-05-18 05:21:00+00:00,"b'Justice for Maguad Siblings. Dili enough ang gihatag sa court. My ghad! Brutal pinatay,tapos ganun nalang? \xf0\x9f\xa4\xac'",Justice for Maguad Siblings Dili enough ang gihatag sa court My ghad Brutal pinatay tapos ganun nalang
1526794950079156224,2022-05-18 05:20:57+00:00,b'Haaaayyy 12hrs!! Sarap matulog. Ganto feeling pala ng tambay hahahhaa',Haaaayyy 12hrs Sarap matulog Ganto feeling pala ng tambay hahahhaa
1526794936401547264,2022-05-18 05:20:53+00:00,b'Magkakaroon ako ng chance na makaharap yung tao na ng block sa akin sa facebook next week. Kung matuloy man itatanong ko yung dahilan para magkaroon na ng closure. \xf0\x9f\x98\x82',Magkakaroon ako ng chance na makaharap yung tao na ng block sa akin sa facebook next week Kung matuloy man itatanong ko yung dahilan para magkaroon na ng closure
1526794928596013056,2022-05-18 05:20:52+00:00,b'mukang cancelledt la union trip ko huhu di ko maiwan aso ko \xf0\x9f\x99\x83',mukang cancelledt la union trip ko huhu di ko maiwan aso ko
1526794926763147264,2022-05-18 05:20:51+00:00,"b'\xf0\x9f\x98\x8d\n\n#travel #Siargao #surigao #Philippines #good #life #birthday2022 #sohotoncove @ Sohoton Cove Jelly Fish Sanctuary, Surigao Del Norte https://t.co/fEqa5QYfjb'",travel Siargao surigao Philippines good life birthday2022 sohotoncove Sohoton Cove Jelly Fish Sanctuary Surigao Del Norte
1526794922950422528,2022-05-18 05:20:50+00:00,b'Sasama ba ko kaso need ko money',Sasama ba ko kaso need ko money
1526794920681345024,2022-05-18 05:20:50+00:00,"b'kabugo sa karon pa na submit ang exam ug activity HAHAHAA tangaa uy, wa pay May nahuman na nakog answer tas karon pa na turn in\xf0\x9f\x98\xac'",kabugo sa karon pa na submit ang exam ug activity HAHAHAA tangaa uy wa pay May nahuman na nakog answer tas karon pa na turn in
1526794896480571392,2022-05-18 05:20:44+00:00,"b'@uno_yvo huy ka hawud nimo, always put in mind na tanan nimo finished priduct is a work of art, be proud if ut kay imo ng gihagoan ang always have a clear intension everytime na mag decorate ka, awa super nice ang gawas ana. \xe2\x98\xba\xef\xb8\x8f. naol bakerist.'",yvo huy ka hawud nimo always put in mind na tanan nimo finished priduct is a work of art be proud if ut kay imo ng gihagoan ang always have a clear intension everytime na mag decorate ka awa super nice ang gawas ana naol bakerist
1526794889983238144,2022-05-18 05:20:42+00:00,b'Feeling ko tuloy may severe anxiety nako haha',Feeling ko tuloy may severe anxiety nako haha
1526794883771830273,2022-05-18 05:20:41+00:00,"b""para sa'yo tatay \xf0\x9f\x8c\xb8 https://t.co/Asv7tcTVtY""",para sa yo tatay
1526794874887950336,2022-05-18 05:20:39+00:00,b'@pilosopaul HAHAHAHA',HAHAHAHA
1526794852981059584,2022-05-18 05:20:34+00:00,b'Desde #filipinas https://t.co/1EkkpH86LU',Desde filipinas
1526794828280827905,2022-05-18 05:20:28+00:00,b'@CholoI_ Masaya naman. Sobrang nakakapagod lang. Siguro dahil galing sa hike nu\xe2\x80\x99ng weekend tapos buhat nu\xe2\x80\x99ng Monday at Tuesday.',Masaya naman Sobrang nakakapagod lang Siguro dahil galing sa hike nu ng weekend tapos buhat nu ng Monday at Tuesday
1526794821808951296,2022-05-18 05:20:26+00:00,b'Noted! \xf0\x9f\x98\x89\xf0\x9f\x92\x95 https://t.co/Lp5euMQ7EW',Noted
1526794820731035648,2022-05-18 05:20:26+00:00,b'@the_altern8 @elio_verse Pasahan ng modtacles yata yon.',altern8 verse Pasahan ng modtacles yata yon
1526794801034973184,2022-05-18 05:20:21+00:00,b'@SnowyETH 0x234Cb49766466191f42eA82a3fd9511755268799',0x234Cb49766466191f42eA82a3fd9511755268799
1526794788909236224,2022-05-18 05:20:18+00:00,"b'@wolfxscar Laters, baby \xf0\x9f\x99\x8a\xf0\x9f\x98\x81'",Laters baby
1526794785574375424,2022-05-18 05:20:18+00:00,b'CHICKEN INASAL...\n_\n@islandchickeninasalboracay #islandchickeninasalboracay #chickeninasal #inasal #manokinasal #chickenbbq #chicken #BBQ #boracay #boracayisland #boracay2022 #boracayeats #boracayfood #food #foodblogger #foodphotography #foodies #foodlover #Eating #Eatout #Yummy https://t.co/72TCzSY6zk',CHICKEN INASAL islandchickeninasalboracay chickeninasal inasal manokinasal chickenbbq chicken BBQ boracay boracayisland boracay2022 boracayeats boracayfood food foodblogger foodphotography foodies foodlover Eating Eatout Yummy
1526794775021514752,2022-05-18 05:20:15+00:00,b'And just like that. One message ruined my whole day. Ang sarap na sana ng gising ko punyeta \xf0\x9f\xa4\xa1',And just like that One message ruined my whole day Ang sarap na sana ng gising ko punyeta
1526794773209632768,2022-05-18 05:20:15+00:00,b'@BTSb_agustd I love korea',agustd I love korea
1526794772505309184,2022-05-18 05:20:14+00:00,b'@cotofficial1 umuwe ka ng maaga!',umuwe ka ng maaga
1526794768595881984,2022-05-18 05:20:13+00:00,b'Asa naman to akoang customer oyy https://t.co/0gMeu61NWh',Asa naman to akoang customer oyy
1526794765617885184,2022-05-18 05:20:13+00:00,b'Isa na lang kulang Lord! JOWANG AFFAM NA GWAPO NA MAYAMAN! haha chz ahaha',Isa na lang kulang Lord JOWANG AFFAM NA GWAPO NA MAYAMAN haha chz ahaha
1526794751210467329,2022-05-18 05:20:09+00:00,b'@geemgalang San ba nakakabili nyan',San ba nakakabili nyan
1526794749276868614,2022-05-18 05:20:09+00:00,b'Mas interesado po ako kay Mickey. Saan po ang pila? \xf0\x9f\x98\x82 https://t.co/yGGXHRDoTe',Mas interesado po ako kay Mickey Saan po ang pila
1526794743446765568,2022-05-18 05:20:07+00:00,b'This bloke is a what happens when you can\xe2\x80\x99t stop using the glass barbecue. \xf0\x9f\x91\x87\xf0\x9f\x8f\xbb https://t.co/lY8MAu7CO3',This bloke is a what happens when you can t stop using the glass barbecue
1526794739768430593,2022-05-18 05:20:07+00:00,b'@xxgrassa Bkit la ka kanina??? Nag attend kalang sana',Bkit la ka kanina Nag attend kalang sana
1526794718646247424,2022-05-18 05:20:02+00:00,b'OPEN SCHOOLS NOW \xe2\x80\xbc Dumadami ang nalulusaw ang brain kakaselpon at kakatiktok \xf0\x9f\x98\xad https://t.co/noGym0LK91',OPEN SCHOOLS NOW Dumadami ang nalulusaw ang brain kakaselpon at kakatiktok
1526794709712388097,2022-05-18 05:19:59+00:00,b'Teng-ene mo RECONCILIATION \xf0\x9f\xa4\xac\xf0\x9f\xa4\xac\xf0\x9f\xa4\xac',Teng ene mo RECONCILIATION
1526794706596012033,2022-05-18 05:19:59+00:00,b'@jemrickseviall hi idol',hi idol
1526794696151814144,2022-05-18 05:19:56+00:00,b'Bat nyo kase ako peyborit gawing poc\xf0\x9f\x99\x84',Bat nyo kase ako peyborit gawing poc
1526794666976235520,2022-05-18 05:19:49+00:00,"b""All Too Well 10min version. No one is allowed to hate that masterpiece. If you hate the song, don't talk to me. https://t.co/ZKVTjKs8Rd""",All Too Well 10min version No one is allowed to hate that masterpiece If you hate the song don t talk to me
1526794646759780352,2022-05-18 05:19:44+00:00,b'@talaylayyo same',same
1526794603306704896,2022-05-18 05:19:34+00:00,b'I woke up soaking wet. https://t.co/WakZjnkLpT',I woke up soaking wet
1526794577625157632,2022-05-18 05:19:28+00:00,"b'""Si maryan hindi pa nag iin, madami na gagawin""'",Si maryan hindi pa nag iin madami na gagawin
1526794553960779776,2022-05-18 05:19:22+00:00,b'@xt1ngluv @neozryu Hnd ako takot kay aya\xf0\x9f\x98\x81\xf0\x9f\x98\x81\xf0\x9f\xa4\xa3\xf0\x9f\xa4\xa3\xf0\x9f\x98\x82\xf0\x9f\x98\x82\xf0\x9f\x98\x82 https://t.co/wAriwFbkiW',Hnd ako takot kay aya
1526794551922655232,2022-05-18 05:19:22+00:00,b'Nakakairita puro photocard stan account ko',Nakakairita puro photocard stan account ko
1526794525897035777,2022-05-18 05:19:16+00:00,b'walangya mo yan inabutan pa ng ulan!!',walangya mo yan inabutan pa ng ulan
1526794496184582144,2022-05-18 05:19:09+00:00,b'Di ako tutuloy sa date tonight hahahah sorry na po. Di pa talaga ako nakakausad. Magiging unfair lang \xf0\x9f\x98\x82',Di ako tutuloy sa date tonight hahahah sorry na po Di pa talaga ako nakakausad Magiging unfair lang
1526794487741444096,2022-05-18 05:19:07+00:00,b'magulo',magulo
1526794467772366849,2022-05-18 05:19:02+00:00,b'Wah may pa welcome back si twiter HAHAHAHAH',Wah may pa welcome back si twiter HAHAHAHAH
1526794466425573376,2022-05-18 05:19:01+00:00,b'@qrikwaerki Libre nak gafen labbit',Libre nak gafen labbit
1526794462969466886,2022-05-18 05:19:01+00:00,b'Narcissist are peculiar subjects to psychoanalyze - I think it most likely stems from childhood entitlement (Parents keep telling them they\xe2\x80\x99re special or different)\n\nOr some form of childhood trauma or severe insecurities',Narcissist are peculiar subjects to psychoanalyze I think it most likely stems from childhood entitlement Parents keep telling them they re special or different Or some form of childhood trauma or severe insecurities
1526794462021550082,2022-05-18 05:19:00+00:00,b'@BTSb_agustd I am from the Philippines \xf0\x9f\x87\xb5\xf0\x9f\x87\xad\xf0\x9f\x87\xb5\xf0\x9f\x87\xad\xf0\x9f\x87\xb5\xf0\x9f\x87\xad',agustd I am from the Philippines
1526794461182935041,2022-05-18 05:19:00+00:00,"b""I'm at @TrendMicro in Pasig City, Pasig https://t.co/KgPkneapqJ""",I m at in Pasig City Pasig
1526794458125443072,2022-05-18 05:18:59+00:00,b'The last man standing is a woman. Her name is Risa Hontiveros. https://t.co/kf3ixuMHaI',The last man standing is a woman Her name is Risa Hontiveros
1526794456619311104,2022-05-18 05:18:59+00:00,b'@thecjseven #PetitionToSeeThisFullPerformanceInASAP',PetitionToSeeThisFullPerformanceInASAP
1526794453427671040,2022-05-18 05:18:58+00:00,"b'Had breakfast in the jungle with friends.  Good morning. @ Sampaloc, Quezon https://t.co/QcRfBdxSTe'",Had breakfast in the jungle with friends Good morning Sampaloc Quezon
1526794446712733697,2022-05-18 05:18:57+00:00,b'Deserve ko maligo ngayon hahaha',Deserve ko maligo ngayon hahaha
1526794407990530049,2022-05-18 05:18:47+00:00,b'@_sisyphus17 mura syag preserved na manok \xf0\x9f\x92\x80\xf0\x9f\x92\x80',sisyphus17 mura syag preserved na manok
1526794388424245249,2022-05-18 05:18:43+00:00,"b""I'm at @Jollibee in Pasig https://t.co/jfKsv58wlX""",I m at in Pasig
1526794377825161216,2022-05-18 05:18:40+00:00,"b'Yeah, i get it. Naglalakad sa palayan, but the point is need pa bang picturan?\xf0\x9f\x99\x84\xf0\x9f\x8c\xbe\xf0\x9f\x8d\x83 https://t.co/EmDmjv7GfI'",Yeah i get it Naglalakad sa palayan but the point is need pa bang picturan
1526794354169262082,2022-05-18 05:18:35+00:00,"b'Sabi na eh, ang short cut is to subsidize the gap. Pano kaya ito implement ng DA or whoever gets in charge of this? I\xe2\x80\x99m not even talking of how worse is this to the fiscal position ah? https://t.co/W2MySF96el'",Sabi na eh ang short cut is to subsidize the gap Pano kaya ito implement ng DA or whoever gets in charge of this I m not even talking of how worse is this to the fiscal position ah
1526794350486663169,2022-05-18 05:18:34+00:00,"b""so-much blessings coming in \xf0\x9f\x99\x8f\xf0\x9f\x8f\xbb must've done something right! \xf0\x9f\x98\xac""",so much blessings coming in must ve done something right
1526794316319821824,2022-05-18 05:18:26+00:00,b'Bat kasi ang kitid ng utak mo. \xf0\x9f\x98\xa2',Bat kasi ang kitid ng utak mo
1526794313677410304,2022-05-18 05:18:25+00:00,b'Gi shagitan nako pero wlaa gyapon ko nakamata \xf0\x9f\x98\x96',Gi shagitan nako pero wlaa gyapon ko nakamata
1526794273441452033,2022-05-18 05:18:15+00:00,b'These Australian brokers are such a pain in the ass!!! \xf0\x9f\x98\xa1',These Australian brokers are such a pain in the ass
1526794270824247298,2022-05-18 05:18:15+00:00,b'Exactly. Been reporting accounts left right and center for almost a week now hahaha https://t.co/Bwf8Cp7LWi',Exactly Been reporting accounts left right and center for almost a week now hahaha
1526794251161415680,2022-05-18 05:18:10+00:00,b'@pseudomando Nice! \xf0\x9f\x98\x8a Chef Cajun in da haus!',Nice Chef Cajun in da haus
1526794247260626944,2022-05-18 05:18:09+00:00,b'Try ko kaya mag MA in Fine Arts \xf0\x9f\xa7\x90',Try ko kaya mag MA in Fine Arts
1526794246690197504,2022-05-18 05:18:09+00:00,"b""Excited to watch the movie, I've read the book (I was a sobbing mess but I finished it in one sitting one Sunday night).. Can't wait for the movie and the song.. \xe2\x99\xa5 https://t.co/fHXs7ut38W""",Excited to watch the movie I ve read the book I was a sobbing mess but I finished it in one sitting one Sunday night Can t wait for the movie and the song
1526794229510381568,2022-05-18 05:18:05+00:00,b'Muntik nako!!! Hahaha buti naayos vpc ni ate jam juskoo\xf0\x9f\xa4\xa3\xf0\x9f\xa4\xa3 https://t.co/08se1F0vcP',Muntik nako Hahaha buti naayos vpc ni ate jam juskoo
1526794225118896130,2022-05-18 05:18:04+00:00,b'@BriAngelo_ Totoo.. HAHAHA',Totoo HAHAHA
1526794206962159616,2022-05-18 05:18:00+00:00,b'@ddyfckmhrd Halla nag squirt.. Haha',Halla nag squirt Haha
1526794186514583552,2022-05-18 05:17:55+00:00,b'GRRRR SUNTOK SA HANGIN TALAGAAAA',GRRRR SUNTOK SA HANGIN TALAGAAAA
1526794166247641088,2022-05-18 05:17:50+00:00,b'@frnchsmy sino ka po ? Hahahaha isa kaba sa gusto sumawsaw sa buhay ko ?',sino ka po Hahahaha isa kaba sa gusto sumawsaw sa buhay ko
1526794163379146752,2022-05-18 05:17:49+00:00,b'Damm!! Im so inlove with you',Damm Im so inlove with you
1526794162171179008,2022-05-18 05:17:49+00:00,b'@Crinzy5 Busy sa au HAHAAHAHAHAHA balik kalang tas kwento mo samin sissyko ^^^',Busy sa au HAHAAHAHAHAHA balik kalang tas kwento mo samin sissyko
1526794161189683200,2022-05-18 05:17:49+00:00,b'@Neonisminism Hindi ah. \xf0\x9f\x98\xa1',Hindi ah
1526794139571847168,2022-05-18 05:17:43+00:00,b'Hindi po. \xf0\x9f\x98\xad Chz. https://t.co/ruenXFu1Pj',Hindi po Chz
1526794134870458368,2022-05-18 05:17:42+00:00,"b'@Rshdbaalawi @SkieeeCaloy @AthanGarciaaa Lunes tayo, ako na nag iinvite sa inyo. Kina Athan G. Hahaha'",Lunes tayo ako na nag iinvite sa inyo Kina Athan G Hahaha
1526794129682083841,2022-05-18 05:17:41+00:00,b'Everyday tagay atay luoya sa atay HAHAHAHAAH \nPs: akong crush ni ha di ni ako HAHAHAAH',Everyday tagay atay luoya sa atay HAHAHAHAAH Ps akong crush ni ha di ni ako HAHAHAAH
1526794104872374273,2022-05-18 05:17:35+00:00,"b'I need massage, bolilao area lng ko, ang affordable lng tani. Dm asap. Thanks.'",I need massage bolilao area lng ko ang affordable lng tani Dm asap Thanks
1526794074841178115,2022-05-18 05:17:28+00:00,b'Ayoko na muna isipin tong work tutal next week pa naman start HAHAHHA',Ayoko na muna isipin tong work tutal next week pa naman start HAHAHHA
1526794069220790272,2022-05-18 05:17:27+00:00,b'Haysss di maka sawa tanawon picture',Haysss di maka sawa tanawon picture
1526794058542481408,2022-05-18 05:17:24+00:00,b'Magaayos na ako ng buhay. Nyeta',Magaayos na ako ng buhay Nyeta
1526794052779159553,2022-05-18 05:17:23+00:00,b'Getting used to riding \xf0\x9f\x9b\xb5 to and from work \xf0\x9f\x91\x8c\xf0\x9f\x8f\xbb',Getting used to riding to and from work
1526794048681684993,2022-05-18 05:17:22+00:00,b'tska na kapag malapit na due date:)',tska na kapag malapit na due date
1526794037378035712,2022-05-18 05:17:19+00:00,b'Pwede mapagod?',Pwede mapagod
1526794018209689600,2022-05-18 05:17:15+00:00,b'@ItsSoy06 All time favorite\xf0\x9f\x98\x8d',All time favorite
1526794013600526336,2022-05-18 05:17:13+00:00,b'Omfg! Gitungab niya ang bacardi yawaaaa ka palahubog diay sa boang oy tabang mananabang',Omfg Gitungab niya ang bacardi yawaaaa ka palahubog diay sa boang oy tabang mananabang
1526794011721146370,2022-05-18 05:17:13+00:00,b'Day 3 of dami quoh pong na accomplish pero mas dami nagamit na gasolina hahaha \xf0\x9f\xaa\xb8',Day 3 of dami quoh pong na accomplish pero mas dami nagamit na gasolina hahaha
1526794007187030016,2022-05-18 05:17:12+00:00,b'@TartagliaAjaxxx when when de sarapen',when when de sarapen
1526794006717313024,2022-05-18 05:17:12+00:00,b'Sino bang Ina o magulang ang Hindi magiging Masaya kapag gagraduate na Ang kanyang anak \n\nNaalala ko nun si mama nung graduation ko siya naglaba namalantsa ng toga ko \xe2\x98\xba\xef\xb8\x8f https://t.co/iazsaFJQ9u',Sino bang Ina o magulang ang Hindi magiging Masaya kapag gagraduate na Ang kanyang anak Naalala ko nun si mama nung graduation ko siya naglaba namalantsa ng toga ko
1526794003823599616,2022-05-18 05:17:11+00:00,b'I love my header \xf0\x9f\x98\x8d',I love my header
1526794000157769730,2022-05-18 05:17:10+00:00,b'@SkieeeCaloy @AthanGarciaaa Sa Lunes na lang naman boss yolaccc',Sa Lunes na lang naman boss yolaccc
1526793963960602625,2022-05-18 05:17:02+00:00,"b'Nagugulat ako sa kulog, sobrang lakas \xf0\x9f\xa5\xba\xf0\x9f\xa5\xba'",Nagugulat ako sa kulog sobrang lakas
1526793948970516484,2022-05-18 05:16:58+00:00,b'Malapit na ako magkaruon nun eh',Malapit na ako magkaruon nun eh
1526793945010778112,2022-05-18 05:16:57+00:00,b'@JoshuaKokong Taraa',Taraa
1526793938618593280,2022-05-18 05:16:56+00:00,b'@drei6100 Do kanami ba',Do kanami ba
1526793928082460672,2022-05-18 05:16:53+00:00,"b'Tangina mo, Melinda https://t.co/DPUjZOpygi'",Tangina mo Melinda
1526793898445897728,2022-05-18 05:16:46+00:00,b'Hindi ko pa na eexperience yung VL tsak SL\xf0\x9f\xa5\xb9',Hindi ko pa na eexperience yung VL tsak SL
1526793896490958848,2022-05-18 05:16:46+00:00,b'@_whoisivs Ganap na binata \xf0\x9f\xa4\x99',whoisivs Ganap na binata
1526793891261067264,2022-05-18 05:16:44+00:00,b'FranSeth \xe2\x98\xba\xf0\x9f\x96\xa4 https://t.co/ghUM6eXFcx',FranSeth
1526793876928749568,2022-05-18 05:16:41+00:00,b'@princesspromos_ @ladyincrypto @moorbounder69 @RemiPromotes @HwanniePromotes @AkzyOx @misufee_Bigwin5 @liza_promotes #\n@kuyawat @GiveAwayHost @kirstingives @izzyb0i',Bigwin5 promotes
1526793842762055681,2022-05-18 05:16:33+00:00,b'Padyak ulit \xf0\x9f\x9a\xb2 @ Metrobank BF Homes https://t.co/Sig9XgLnDq',Padyak ulit Metrobank BF Homes
1526793823434973184,2022-05-18 05:16:28+00:00,b'Kainis naman',Kainis naman
1526793817088589824,2022-05-18 05:16:27+00:00,b'ka igang baaaaa',ka igang baaaaa
1526793810935619591,2022-05-18 05:16:25+00:00,b'Wa nko paki basta kay kaihiun nko nya out of order ang cr sa women \xf0\x9f\xa4\xa3',Wa nko paki basta kay kaihiun nko nya out of order ang cr sa women
1526793793588305925,2022-05-18 05:16:21+00:00,"b'My mars return. But this time, with Jupiter in the sign. Bouta be lit https://t.co/gb6Z1WlC6J'",My mars return But this time with Jupiter in the sign Bouta be lit
1526793787485601792,2022-05-18 05:16:20+00:00,b'Feeling ko ang hirap mag adjust nito\xf0\x9f\xa5\xba',Feeling ko ang hirap mag adjust nito
1526793784708648961,2022-05-18 05:16:19+00:00,"b'naconfirm ko  sa tl ko ung announcement na RTO ay parang panakot lang sa mga employees. tapos ngayon may bagong set ng pc na pinadala lalo akong nagkaroon ng pag.asa sa mas matagal na WFH. kaya naman kasi eh, nakapag adjust na kame sa new normal. \xf0\x9f\x99\x8f\xf0\x9f\x8f\xbd'",naconfirm ko sa tl ko ung announcement na RTO ay parang panakot lang sa mga employees tapos ngayon may bagong set ng pc na pinadala lalo akong nagkaroon ng pag asa sa mas matagal na WFH kaya naman kasi eh nakapag adjust na kame sa new normal
1526793775149748225,2022-05-18 05:16:17+00:00,b'@LeonardMargate uso ga sayo maligo',uso ga sayo maligo
1526793773161648128,2022-05-18 05:16:16+00:00,b'@frnchsmy Di i even fucking know you ?',Di i even fucking know you
1526793764383367169,2022-05-18 05:16:14+00:00,b'@chitaglorya__ @FortProtocol #FORT',FORT
1526793730316832770,2022-05-18 05:16:06+00:00,b'kain muna ko jabe tanginamo kc bkt kumain kna agad',kain muna ko jabe tanginamo kc bkt kumain kna agad
1526793730082357248,2022-05-18 05:16:06+00:00,"b""It's my favorite season y'all \xf0\x9f\xa4\xa7\xf0\x9f\xa4\x9e""",It s my favorite season y all
1526793722553581573,2022-05-18 05:16:04+00:00,b'Maghahanap talaga ako ng bagong work na\xf0\x9f\xa5\xba',Maghahanap talaga ako ng bagong work na
1526793720992935936,2022-05-18 05:16:04+00:00,b'@C1e000__ NaOl',NaOl
