id,created_at,text - utf-8,simplified
1526813720839454720,2022-05-18 06:35:32+00:00,b'@mrshundred Anong sasabihin? Haha',Anong sasabihin Haha
1526813716301455361,2022-05-18 06:35:31+00:00,"b'My lady venom \xf0\x9f\x98\x8e\xf0\x9f\xa5\xb0\xf0\x9f\x90\x8d @thejujubrr @ Buda, Marilog District https://t.co/fbbcfqk0gv'",My lady venom Buda Marilog District
1526813713805692928,2022-05-18 06:35:30+00:00,b'Gustuhon nlng tika sa tago aww',Gustuhon nlng tika sa tago aww
1526813698412597249,2022-05-18 06:35:27+00:00,b'one wrong move and you will be eliminated \xf0\x9f\x98\x82',one wrong move and you will be eliminated
1526813683242106880,2022-05-18 06:35:23+00:00,b'Di naman ako nagdadala ng payong pero automatic nakapag dala ako dahil kay rudy',Di naman ako nagdadala ng payong pero automatic nakapag dala ako dahil kay rudy
1526813680176103424,2022-05-18 06:35:22+00:00,b'5mins until Philippines vs Laos MLBB #SEAGames2022 #31stSEAGames\n\n\xf0\x9f\x87\xb5\xf0\x9f\x87\xad #LakadMatatag',5mins until Philippines vs Laos MLBB SEAGames2022 31stSEAGames LakadMatatag
1526813678443429888,2022-05-18 06:35:22+00:00,b'Midweek blues. https://t.co/aUMR5qDaaM',Midweek blues
1526813675968860161,2022-05-18 06:35:21+00:00,b'@chard_chupz Layo mo pala haha',chupz Layo mo pala haha
1526813673355759617,2022-05-18 06:35:21+00:00,b'@JeoCorton Hehe thanks jeo',Hehe thanks jeo
1526813664409718785,2022-05-18 06:35:19+00:00,b'Nami pa tne tulog ko subong ba \xf0\x9f\x98\xb0\xf0\x9f\x98\x93',Nami pa tne tulog ko subong ba
1526813661024485377,2022-05-18 06:35:18+00:00,b'@rhnbldg Kung pwede lang kita samahan \xf0\x9f\x98\xab',Kung pwede lang kita samahan
1526813647259209729,2022-05-18 06:35:14+00:00,b'@moeatnz Ikaw na mag picture moe since may camera ka na na hawak hahahaha',Ikaw na mag picture moe since may camera ka na na hawak hahahaha
1526813643643375617,2022-05-18 06:35:14+00:00,b'Diko alam saan ko pupunta kilig ko ngayun hahaha.',Diko alam saan ko pupunta kilig ko ngayun hahaha
1526813628157992960,2022-05-18 06:35:10+00:00,b'a kendrick/drake/j cole concert before i die',a kendrick drake j cole concert before i die
1526813625033191424,2022-05-18 06:35:09+00:00,b'@SIMONElikeyou trew',trew
1526813622764072960,2022-05-18 06:35:09+00:00,b'@samanthatancdeo Thank you Atty.\xe2\x9d\xa4\xef\xb8\x8f\xe2\x9d\xa4\xef\xb8\x8f\xe2\x9d\xa4\xef\xb8\x8f',Thank you Atty
1526813606708658176,2022-05-18 06:35:05+00:00,b'@1n33dr3h4b Bitin.jpeg',Bitin jpeg
1526813579592486912,2022-05-18 06:34:58+00:00,b'Happy kaayo ko nakita nako si Wise og Venus og balik sa dula \xe2\x9d\xa4\xef\xb8\x8f https://t.co/6bRqk2G1tG',Happy kaayo ko nakita nako si Wise og Venus og balik sa dula
1526813555948892160,2022-05-18 06:34:53+00:00,b'@kuyamoAndreei ASAP please',ASAP please
1526813551511293953,2022-05-18 06:34:52+00:00,b'@obejeroflsh Edi mag flynn',Edi mag flynn
1526813549191757824,2022-05-18 06:34:51+00:00,b'@MANDIRIGMA_10 HAHAHA merese pjud diay HAHAHA',10 HAHAHA merese pjud diay HAHAHA
1526813531315679232,2022-05-18 06:34:47+00:00,b'Sheesh. #NewProfilePic https://t.co/lW7zLIM0ry',Sheesh NewProfilePic
1526813526689316864,2022-05-18 06:34:46+00:00,b'Ambot dali ra gyud ko ma attract og puti ng guy \xf0\x9f\x98\x8d labaw na if naay tattoo.',Ambot dali ra gyud ko ma attract og puti ng guy labaw na if naay tattoo
1526813504509841408,2022-05-18 06:34:40+00:00,b'@imjohndizon @_dalengDale Same!!! \xf0\x9f\x92\x9b',dalengDale Same
1526813495387295744,2022-05-18 06:34:38+00:00,b'Looking for Easter egg. Pwede pa ba? https://t.co/hDIAMff0gG',Looking for Easter egg Pwede pa ba
1526813474743263232,2022-05-18 06:34:33+00:00,b'Kwaknit! \xf0\x9f\xa5\xb0 https://t.co/HCUtaYGBb8',Kwaknit
1526813472679337984,2022-05-18 06:34:33+00:00,b'why dysmenorrhea hurts me every month',why dysmenorrhea hurts me every month
1526813469948882944,2022-05-18 06:34:32+00:00,b'ayusin sana ni Ramirez desisyon nya sa buhay \xf0\x9f\x99\x84',ayusin sana ni Ramirez desisyon nya sa buhay
1526813466635276288,2022-05-18 06:34:31+00:00,b'Ang cutie mag sleep ni snow \xf0\x9f\xa5\xb9',Ang cutie mag sleep ni snow
1526813452173357056,2022-05-18 06:34:28+00:00,b'@RFranco04 Umiiyim ba \xe2\x80\x98yan pag wala sa mood? Hahaha',Umiiyim ba yan pag wala sa mood Hahaha
1526813448968888322,2022-05-18 06:34:27+00:00,b'Hala @kvn_akuseru ang Ganda. Na in love yata ako bigla \xf0\x9f\x99\x8a\xf0\x9f\x99\x8a\xf0\x9f\x98\x83\xf0\x9f\x98\x83 https://t.co/321F8qnX0h',Hala akuseru ang Ganda Na in love yata ako bigla
1526813443289780224,2022-05-18 06:34:26+00:00,b'@eisenharten Hi po sa nipols na bakat \xf0\x9f\x98\x81\xf0\x9f\x98\x81\xf0\x9f\x98\x81\xf0\x9f\x98\x81\xf0\x9f\x98\x98\xf0\x9f\x98\x98\xf0\x9f\x98\x98',Hi po sa nipols na bakat
1526813440223809537,2022-05-18 06:34:25+00:00,b'ah maka iyak ug maka inspire kay ning mga kaila nako na mang graduate ay \xf0\x9f\xa5\xba congrats all \xf0\x9f\x8e\x89\xf0\x9f\x91\x8f ipadayon inyong paglambo \xf0\x9f\x92\x97\xf0\x9f\x92\x97 love you all',ah maka iyak ug maka inspire kay ning mga kaila nako na mang graduate ay congrats all ipadayon inyong paglambo love you all
1526813439984816128,2022-05-18 06:34:25+00:00,"b""If you're looking for work in #Pasig, NCR, check out this #Sales job via the link in our bio: Operations Specialist at Insight""",If you re looking for work in Pasig NCR check out this Sales job via the link in our bio Operations Specialist at Insight
1526813436797018113,2022-05-18 06:34:24+00:00,b'@orangelemonshop @acarbernales  we want to see them live. https://t.co/IdDP1YXDEE',we want to see them live
1526813405662703616,2022-05-18 06:34:17+00:00,b'Much needed break \xf0\x9f\x92\x96\xe2\x9c\xa8\n\nExpect for late replies po cause we\xe2\x80\x99ll have fam time muna. Take care everyone! \xf0\x9f\xa4\x97 https://t.co/bBQtxVNaCc',Much needed break Expect for late replies po cause we ll have fam time muna Take care everyone
1526813392354541568,2022-05-18 06:34:14+00:00,"b'Lakas ng ulan pota. Sarap mag jable Hahaha charot,'",Lakas ng ulan pota Sarap mag jable Hahaha charot
1526813386541256704,2022-05-18 06:34:12+00:00,b'@JemFerrer @MessMinchin3 Dito pa nga yan pinapatira hahaha',Dito pa nga yan pinapatira hahaha
1526813384473075712,2022-05-18 06:34:12+00:00,b'@Babychiyan0411 @lagahitjm1 @ethannlpzz1 @Rain120697 @_PrincexEA @its_Louis14 @Pausibles @MeowDevil13 @mckyjns24 @VDaksz7 @jjbslo18 @elyenparadox @MANDIRIGMA_10 \xf0\x9f\x99\x88\xf0\x9f\x99\x88\xf0\x9f\x99\x88',PrincexEA Louis14 10
1526813362708852737,2022-05-18 06:34:07+00:00,b'@Hamwxyz @chongneck Power \xf0\x9f\x98\x82',Power
1526813354563579904,2022-05-18 06:34:05+00:00,"b'tama yung ""malayo pa ako pero malayo na ako"" bawal mapagod, patuloy lang na lalaban \xf0\x9f\x92\xaa'",tama yung malayo pa ako pero malayo na ako bawal mapagod patuloy lang na lalaban
1526813336934809600,2022-05-18 06:34:01+00:00,b'Gusto ko lang sabihin na matagal na kaming magkakilala ni Mira pero ngayon lang kami naging close dahil kay VP Leni. Hahahaha @miraclevillegs_ https://t.co/CVgnkbTPB3',Gusto ko lang sabihin na matagal na kaming magkakilala ni Mira pero ngayon lang kami naging close dahil kay VP Leni Hahahaha
1526813332274982912,2022-05-18 06:33:59+00:00,b'did you ever sacrifice your own happiness for the sake of other people\xe2\x80\x99s happiness? - always \xf0\x9f\x98\xa2',did you ever sacrifice your own happiness for the sake of other people s happiness always
1526813315812716544,2022-05-18 06:33:55+00:00,b'@FuckTheworld_36 Done',36 Done
1526813304550989825,2022-05-18 06:33:53+00:00,b'I badly miss your cuddle \xf0\x9f\x98\x94',I badly miss your cuddle
1526813301854056448,2022-05-18 06:33:52+00:00,b'So yan na ba yung ulan? \xf0\x9f\xa4\xad',So yan na ba yung ulan
1526813300633534464,2022-05-18 06:33:52+00:00,b'@frnchsmy Di ka ba tigang ngayon? Parang kasi eh. Dami mong alam',Di ka ba tigang ngayon Parang kasi eh Dami mong alam
1526813300205309957,2022-05-18 06:33:52+00:00,b'kanami sang connection globe ah',kanami sang connection globe ah
1526813282425638912,2022-05-18 06:33:48+00:00,b'hahahaha soo bakit??',hahahaha soo bakit
1526813281297797121,2022-05-18 06:33:47+00:00,b'Ng attend ta class para sa chika. \xf0\x9f\xa4\xa3',Ng attend ta class para sa chika
1526813278550102016,2022-05-18 06:33:47+00:00,b'@Joyyiieee_ walang pipigil for todays videow',walang pipigil for todays videow
1526813270186741760,2022-05-18 06:33:45+00:00,b'Baka dito na bumigay yung sanity ko emz hahahahaha',Baka dito na bumigay yung sanity ko emz hahahahaha
1526813256022491136,2022-05-18 06:33:41+00:00,b'@SleepyChinito_ taraaaa punta tyo sa school hahaha',taraaaa punta tyo sa school hahaha
1526813251811409920,2022-05-18 06:33:40+00:00,b'@amitkejriwal01 @thefatcatsNFT @SamuldeHanna \n@KimPachec0 \n@JessieTwins09 \n@BugasDoel \n@JamineAbella \n\nDC NAME: Chacha#7095 https://t.co/2aPw7Tt4dE',DC NAME Chacha 7095
1526813238519771136,2022-05-18 06:33:37+00:00,b'@CtrlAltDltLck Beke nemen Lods....',Beke nemen Lods
1526813221629222912,2022-05-18 06:33:33+00:00,b'@iamjekoy Ayaan na ang magpapabasa ng iyong kweba sismars. Ilaban mo. Ilaban mo. Hahaha',Ayaan na ang magpapabasa ng iyong kweba sismars Ilaban mo Ilaban mo Hahaha
1526813215279448064,2022-05-18 06:33:31+00:00,b'astigag accent uy',astigag accent uy
1526813211005071360,2022-05-18 06:33:30+00:00,b'ehe naka pang ukay ragyud',ehe naka pang ukay ragyud
1526813204965249024,2022-05-18 06:33:29+00:00,b'Kpoy seg heart react sa imo nga pic oy \xf0\x9f\x98\x82',Kpoy seg heart react sa imo nga pic oy
1526813204000542721,2022-05-18 06:33:29+00:00,"b'Yeah, i get it. Gragraduate ang anak, but the point is need pa bang picturan?'",Yeah i get it Gragraduate ang anak but the point is need pa bang picturan
1526813191799336960,2022-05-18 06:33:26+00:00,"b'i can feel myself breaking, piece by piece.'",i can feel myself breaking piece by piece
1526813187957399552,2022-05-18 06:33:25+00:00,"b'jwu from a nap, workout muna ako.'",jwu from a nap workout muna ako
1526813187915407360,2022-05-18 06:33:25+00:00,b'@your_ama_ako Swahe po. Para masarap isigang. \xf0\x9f\x98\x85',ama ako Swahe po Para masarap isigang
1526813177433862145,2022-05-18 06:33:22+00:00,b'I therefore conclude hahahahaha na Carrie bradshawwww ako hindi samantha jonesss kasi pareho kami na Hopia sa pagmamahal at hindi active ang sexlife \xf0\x9f\x98\x82\xf0\x9f\x98\x82\xf0\x9f\x98\x82 may times na Rich madalas brokeeee HAHAHAHAHAHA we have a lot in common! Skl HAHAHAHA',I therefore conclude hahahahaha na Carrie bradshawwww ako hindi samantha jonesss kasi pareho kami na Hopia sa pagmamahal at hindi active ang sexlife may times na Rich madalas brokeeee HAHAHAHAHAHA we have a lot in common Skl HAHAHAHA
1526813145095733248,2022-05-18 06:33:15+00:00,b'Wag kana umulan pano ako makakaalis',Wag kana umulan pano ako makakaalis
1526813101051375616,2022-05-18 06:33:04+00:00,b'Tama pa ba tong pinag gagawa ko sa ppt',Tama pa ba tong pinag gagawa ko sa ppt
1526813055761657856,2022-05-18 06:32:53+00:00,b'@1n33dr3h4b Ako na kagigising lang \xf0\x9f\xa4\x97',Ako na kagigising lang
1526813052833632256,2022-05-18 06:32:53+00:00,"b'@ibuan_normalyn Let me tell you about real life in the social media age . Risk and reward is amplified. The good news , more accountability. Which is good for you and me'",normalyn Let me tell you about real life in the social media age Risk and reward is amplified The good news more accountability Which is good for you and me
1526813048781959168,2022-05-18 06:32:52+00:00,b'ANG INIT',ANG INIT
1526813047461150720,2022-05-18 06:32:51+00:00,"b""Thank God for the good news today. \n\nPassed the first round. Let's go round 2.""",Thank God for the good news today Passed the first round Let s go round 2
1526813005622964225,2022-05-18 06:32:42+00:00,b'Oh loko ano to?  Lol \xf0\x9f\x98\x82 https://t.co/ZDJSx6PTPn',Oh loko ano to Lol
1526812996789743617,2022-05-18 06:32:39+00:00,b'Good afternoon everyone \xf0\x9f\xa5\xb0 https://t.co/Chn8hcBSFd',Good afternoon everyone
1526812996412272641,2022-05-18 06:32:39+00:00,b'Yayy nakaset na ang Quarterfinals game',Yayy nakaset na ang Quarterfinals game
1526812995107827712,2022-05-18 06:32:39+00:00,b'@girunnie Congrats Kuys! \xf0\x9f\x92\x96',Congrats Kuys
1526812987985498112,2022-05-18 06:32:37+00:00,"b""Walang internet for today's bidyow. Hype ka PLDT. Char. \xf0\x9f\x98\x86\xf0\x9f\xa5\xb9""",Walang internet for today s bidyow Hype ka PLDT Char
1526812979958022146,2022-05-18 06:32:35+00:00,b'@lesiervo Inom',Inom
1526812959124512768,2022-05-18 06:32:30+00:00,b'@eiiiiron Nomi tayo oo! Huhuhu wala nman kasi tayo ibang HS friends dito eh sabit mo nalang ako sa friends mo haha',Nomi tayo oo Huhuhu wala nman kasi tayo ibang HS friends dito eh sabit mo nalang ako sa friends mo haha
1526812956813840384,2022-05-18 06:32:30+00:00,b'Pisstee anader  gamay og score!!! Hala ywa',Pisstee anader gamay og score Hala ywa
1526812956490469376,2022-05-18 06:32:30+00:00,b'@nhonhomalay Hahahhahahayahhaghahh',Hahahhahahayahhaghahh
1526812954439454720,2022-05-18 06:32:29+00:00,"b""sobrang blessed na hindi na nag aaway ang magulang ko dahil sa financial problems, sometimes napo provide ko na din yung mga bagay na kagustohan nila dahil sa sipag at tiyaga ko juskooo grabe ang subject na 'to""",sobrang blessed na hindi na nag aaway ang magulang ko dahil sa financial problems sometimes napo provide ko na din yung mga bagay na kagustohan nila dahil sa sipag at tiyaga ko juskooo grabe ang subject na to
1526812937683607557,2022-05-18 06:32:25+00:00,b'My tempered before is the matte ceramic. Changed to glass again \xf0\x9f\xa4\xad',My tempered before is the matte ceramic Changed to glass again
1526812930809135110,2022-05-18 06:32:24+00:00,b'Bibimbappers https://t.co/j12Ndca5DK',Bibimbappers
1526812894658080768,2022-05-18 06:32:15+00:00,b'@crizythin kita na pud puhon \xe2\x98\xba\xef\xb8\x8f\xe2\x98\xba\xef\xb8\x8f',kita na pud puhon
1526812886508523520,2022-05-18 06:32:13+00:00,b'gusto kong mag kape',gusto kong mag kape
1526812869269983235,2022-05-18 06:32:09+00:00,b'no te preocupes hermana si falla ser\xc3\xa9 ruidoso aqu\xc3\xad en twitter :3',no te preocupes hermana si falla ser ruidoso aqu en twitter 3
1526812860604874752,2022-05-18 06:32:07+00:00,"b""This is the video of #PBBM in Australia that they didn't want you to see. \xe2\x9d\xa4\n\n@bongbongmarcos \n@indaysara \n@teddyboylocsin https://t.co/RMUI4bTT2X""",This is the video of PBBM in Australia that they didn t want you to see
1526812840509640710,2022-05-18 06:32:02+00:00,b'@kuyamoAndreei Bisita raman ko beh',Bisita raman ko beh
1526812827675000832,2022-05-18 06:31:59+00:00,b'ur pov https://t.co/BDXcFncOUs',ur pov
1526812817944215553,2022-05-18 06:31:57+00:00,"b'@notbuckyb @MCU_Direct Just kidding, or am I?'",Direct Just kidding or am I
1526812815108890624,2022-05-18 06:31:56+00:00,b'Hilo na aq sa daming gagawin',Hilo na aq sa daming gagawin
1526812810889789440,2022-05-18 06:31:55+00:00,b'This really made my day\n#WellManneredIsBetterThanWellEducated https://t.co/FtLBvmXCfT',This really made my day WellManneredIsBetterThanWellEducated
1526812806083153920,2022-05-18 06:31:54+00:00,b'Hotpot please \xf0\x9f\xa5\xb2',Hotpot please
1526812800521162752,2022-05-18 06:31:53+00:00,b'Grabe ka @NikkoRMS!!! Bawal ka mamatay sis https://t.co/ot3a54wKqp',Grabe ka Bawal ka mamatay sis
1526812791868227584,2022-05-18 06:31:51+00:00,b'kaso putangina kase',kaso putangina kase
1526812789276233728,2022-05-18 06:31:50+00:00,b'@albashitty @Thecarlstephen HAHAHAHA using mouth',HAHAHAHA using mouth
1526812784935063553,2022-05-18 06:31:49+00:00,b'I\xe2\x80\x99ll wait..... 4 u :)',I ll wait 4 u
1526812759077183488,2022-05-18 06:31:43+00:00,"b'You know why this defeat hurts so much?\n\nBecause apart from not letting the best candidate win, in the natural order of things and under moral justice, wrongdoings are punished and wrongdoers are made accountable.\n\nUnder the universal rule of karma, nothing about this is normal.'",You know why this defeat hurts so much Because apart from not letting the best candidate win in the natural order of things and under moral justice wrongdoings are punished and wrongdoers are made accountable Under the universal rule of karma nothing about this is normal
1526812758594887684,2022-05-18 06:31:43+00:00,b'@itskier_king Tagae mouth wash...',king Tagae mouth wash
1526812755260387330,2022-05-18 06:31:42+00:00,b'ana diay na? ayha ramu manampit nako inig naa muy kinahanglan.',ana diay na ayha ramu manampit nako inig naa muy kinahanglan
1526812751703994368,2022-05-18 06:31:41+00:00,b'Tagal naman dumaan ng ulan',Tagal naman dumaan ng ulan
1526812749505802241,2022-05-18 06:31:40+00:00,b'may pag-asa pa',may pag asa pa
1526812749430673408,2022-05-18 06:31:40+00:00,"b'Grabe, laki ng nilinaw ng phone ko. Malaking factor talaga yung tempered! Hahaha \xf0\x9f\xa4\xaa'",Grabe laki ng nilinaw ng phone ko Malaking factor talaga yung tempered Hahaha
1526812728395849728,2022-05-18 06:31:35+00:00,b'@Ratbu8 @NewGovOrgABF @CIDG_PNP Puede po bang paki-check itong account na nag-papakalat ng fake news. Maraming salamat po.',PNP Puede po bang paki check itong account na nag papakalat ng fake news Maraming salamat po
1526812726084808704,2022-05-18 06:31:35+00:00,"b'\xcb\x97\xcb\x8f\xcb\x8b  wts lfb ph help rt \xc2\xb4\xcb\x8e\xcb\x97\n\n[RARE] legend of the blue sea ost album 2 CD + DVD\n\xe3\x80\xb0\xef\xb8\x8f new, still with original packaging\n\xe3\x80\xb0\xef\xb8\x8f 50% dp to secure, remaining balance thru shopee c/o once onhand in PH \n\n\xf0\x9f\x8f\xb7 actor lee min ho jung ji hyun gianna jun lobts merch kdrama original sound track https://t.co/KTjoS2CQGy'",wts lfb ph help rt RARE legend of the blue sea ost album 2 CD DVD new still with original packaging 50 dp to secure remaining balance thru shopee c o once onhand in PH actor lee min ho jung ji hyun gianna jun lobts merch kdrama original sound track
1526812725954768896,2022-05-18 06:31:35+00:00,b'Golds\xf0\x9f\x98\x8d https://t.co/qrKfgHxDFK',Golds
1526812721886691328,2022-05-18 06:31:34+00:00,b'love talaga si gavin hahahaha',love talaga si gavin hahahaha
1526812721395576833,2022-05-18 06:31:34+00:00,b'Game na ulit!!! \n#longleggedyern\n#TrustTheProcess https://t.co/DjH7OFOUrn',Game na ulit longleggedyern TrustTheProcess
1526812706920988672,2022-05-18 06:31:30+00:00,b'Nabili din kita\xf0\x9f\x92\x96 https://t.co/mSLkk9Eqq6',Nabili din kita
1526812706086395904,2022-05-18 06:31:30+00:00,b'@notbuckyb @MCU_Direct Nowadays*',Direct Nowadays
1526812678643015682,2022-05-18 06:31:24+00:00,b'Ang bobo mo talaga \xf0\x9f\x92\x85',Ang bobo mo talaga
1526812675421851648,2022-05-18 06:31:23+00:00,b'kung kelan patapos na sy saka dehado',kung kelan patapos na sy saka dehado
1526812671550836736,2022-05-18 06:31:22+00:00,b'@smninews @ROVIMAX true',true
1526812663459721216,2022-05-18 06:31:20+00:00,b'@maeannesalazar Kaya gani. Nag take advantage jud sila.',Kaya gani Nag take advantage jud sila
1526812661597343744,2022-05-18 06:31:19+00:00,"b'muntik ng tumulo ang luha ko yawa, kasi nong mga nakaraang buwan palagi akong umiiyak dahil sa problema namin may times pa na nakikita kong umiiyak ang magulang ko dahil sa kahirapan at the same time sobrang saya ko kasi nakaalis na kami sa ganoong buhay'",muntik ng tumulo ang luha ko yawa kasi nong mga nakaraang buwan palagi akong umiiyak dahil sa problema namin may times pa na nakikita kong umiiyak ang magulang ko dahil sa kahirapan at the same time sobrang saya ko kasi nakaalis na kami sa ganoong buhay
1526812657860644864,2022-05-18 06:31:19+00:00,b'Ano kamo yaya \xe2\x80\x9cjust respect the will of Filipinos\xe2\x80\x9d?\xe2\x80\xa6.bungol kaba baka \xe2\x80\x9cjust respect the will of VVM\xe2\x80\x9d yann ang totoo!\xf0\x9f\xa4\xae\xf0\x9f\xa4\xae\xf0\x9f\xa4\xae',Ano kamo yaya just respect the will of Filipinos bungol kaba baka just respect the will of VVM yann ang totoo
1526812650864119810,2022-05-18 06:31:17+00:00,b'Stress bhie',Stress bhie
1526812637388222464,2022-05-18 06:31:14+00:00,b'Ano itu? https://t.co/aR8on0cQYV',Ano itu
1526812637195272192,2022-05-18 06:31:14+00:00,b'Ibigay ang hilig\xf0\x9f\x91\x8d',Ibigay ang hilig
1526812617943044097,2022-05-18 06:31:09+00:00,b'The City of Smiles iloilo https://t.co/G0N3jBFgzv',The City of Smiles iloilo
1526812591481233408,2022-05-18 06:31:03+00:00,b'Labyooooo @miggymiggydoo sending na poooo HAHAHA https://t.co/WyJLAA1W4b',Labyooooo sending na poooo HAHAHA
1526812554885931008,2022-05-18 06:30:54+00:00,b'@celsokyliex baka may ma-reco ka na din. \xf0\x9f\x98\x8a',baka may ma reco ka na din
1526812548124708865,2022-05-18 06:30:52+00:00,b'High maintenance daw ako. Gagu toothbrush ko nga umaabot ng dalawa hanggang tatlong buwan. \xf0\x9f\xa4\xa3 inanyuuu.',High maintenance daw ako Gagu toothbrush ko nga umaabot ng dalawa hanggang tatlong buwan inanyuuu
1526812547189714945,2022-05-18 06:30:52+00:00,b'Too attached beh',Too attached beh
1526812545474265088,2022-05-18 06:30:52+00:00,b'Almost Friday!! https://t.co/rB0KXPTfkM',Almost Friday
1526812535726682113,2022-05-18 06:30:49+00:00,b'Lakas naman maka ignore pero pag tigang ka ambilis \xf0\x9f\x98\x82',Lakas naman maka ignore pero pag tigang ka ambilis
1526812523982249986,2022-05-18 06:30:47+00:00,b'Tamad na tamad ako today tangina!',Tamad na tamad ako today tangina
1526812518567378944,2022-05-18 06:30:45+00:00,b'Ano maganda?\xf0\x9f\xa4\x94 https://t.co/cP0VCTs8Us',Ano maganda
1526812504331935744,2022-05-18 06:30:42+00:00,b'di ko pa ma uninstall shopee kag shein ko may 5 pako ka coming ywa tama tama man ah pag release sahud ibayad dayun',di ko pa ma uninstall shopee kag shein ko may 5 pako ka coming ywa tama tama man ah pag release sahud ibayad dayun
1526812502981771264,2022-05-18 06:30:42+00:00,b'@ooddiicckk Haggard!!!',Haggard
1526812486665523201,2022-05-18 06:30:38+00:00,b'daghag uten akong timeline yawa.',daghag uten akong timeline yawa
1526812486137450496,2022-05-18 06:30:38+00:00,b'5th day in Bulakan..',5th day in Bulakan
1526812484346081280,2022-05-18 06:30:37+00:00,"b'bumababa man, aahon ulet'",bumababa man aahon ulet
1526812463844716545,2022-05-18 06:30:32+00:00,b'Wrong napud akong na feel ayy\xe2\x80\xa6 naay something',Wrong napud akong na feel ayy naay something
1526812461604581377,2022-05-18 06:30:32+00:00,b'Just like in the painting\xf0\x9f\x8c\x84 https://t.co/7OGqxgij6l',Just like in the painting
1526812456823033856,2022-05-18 06:30:31+00:00,"b'lmao, trigger warning, our beach house has this too: https://t.co/V14ITSL8he'",lmao trigger warning our beach house has this too
1526812451945467904,2022-05-18 06:30:30+00:00,b'HAHAHAHA garo bo2 tangina HAHAHAHHA',HAHAHAHA garo bo2 tangina HAHAHAHHA
1526812441996251137,2022-05-18 06:30:27+00:00,b'Help!! Pa cool kid masyado \xf0\x9f\x98\xad\xf0\x9f\x98\x86\n#aslom',Help Pa cool kid masyado aslom
1526812433536679936,2022-05-18 06:30:25+00:00,b'@flamboyantphil_ @ROVIMAX korek',korek
1526812433251127297,2022-05-18 06:30:25+00:00,b'konti nalang mag aalter na din ako \xf0\x9f\xa4\xa3',konti nalang mag aalter na din ako
1526812428150771712,2022-05-18 06:30:24+00:00,b'Do you remember when you joined Twitter? I do! #MyTwitterAnniversary https://t.co/2GynkmYvmR',Do you remember when you joined Twitter I do MyTwitterAnniversary
1526812411193221120,2022-05-18 06:30:20+00:00,b'@UniXGamingGuild @Permissionless Go unix',Go unix
1526812391077343232,2022-05-18 06:30:15+00:00,b'kasama ko mamaya karuma ko \xf0\x9f\xa5\xb0',kasama ko mamaya karuma ko
1526812363692703744,2022-05-18 06:30:08+00:00,b'*mali\xf0\x9f\xa5\xb5',mali
1526812323859640320,2022-05-18 06:29:59+00:00,b'Happy 47th Wedding Anniversary Mommy and Daddy!\n\nSana nagustuhan niyo ang simpleng handa namin ni Ate. @ Lancaster New City Cavite Philippines https://t.co/jus8gq9nPK',Happy 47th Wedding Anniversary Mommy and Daddy Sana nagustuhan niyo ang simpleng handa namin ni Ate Lancaster New City Cavite Philippines
1526812311645614080,2022-05-18 06:29:56+00:00,"b'bitch, mahal kita. wag kang mag give up. kwarta ra na, wala sad ko ana.'",bitch mahal kita wag kang mag give up kwarta ra na wala sad ko ana
1526812311251730434,2022-05-18 06:29:56+00:00,b'Gina big deal lagi nako tanan\xf0\x9f\x98\xad',Gina big deal lagi nako tanan
1526812310765191169,2022-05-18 06:29:56+00:00,b'HAHAHAHAHA grabeha ka accurate \xf0\x9f\x98\xad\xf0\x9f\x98\x82 https://t.co/5rx8A455bj',HAHAHAHAHA grabeha ka accurate
1526812302619471872,2022-05-18 06:29:54+00:00,b'@maeannesalazar Bahay deca',Bahay deca
1526812294990430208,2022-05-18 06:29:52+00:00,"b'Today, kaon is life'",Today kaon is life
1526812289092886529,2022-05-18 06:29:51+00:00,b'boring dayss',boring dayss
1526812280863674370,2022-05-18 06:29:49+00:00,b'sorry tao lang nagka lami',sorry tao lang nagka lami
1526812274890919936,2022-05-18 06:29:47+00:00,b'ay mhie wag kang mang agaw',ay mhie wag kang mang agaw
1526812269493231616,2022-05-18 06:29:46+00:00,b'BBMSARA PASASALAMAT\n#MajorityPresidentBBM \n#TunayNaBalita \n#YoutubeUnblockMataNgAgila https://t.co/kspWzGiB9Z',BBMSARA PASASALAMAT MajorityPresidentBBM TunayNaBalita YoutubeUnblockMataNgAgila
1526812263729926146,2022-05-18 06:29:45+00:00,b'@_andyhaya OMGGG. Goooo PLAB!!!! \xf0\x9f\x92\x96\xf0\x9f\x92\xaf',andyhaya OMGGG Goooo PLAB
1526812262031233029,2022-05-18 06:29:44+00:00,b'ramdam na ramdam ang pagiging middle child. https://t.co/bgIWwpTzBI',ramdam na ramdam ang pagiging middle child
1526812256847114240,2022-05-18 06:29:43+00:00,"b'@kervsky Yup, it still stands. ;-)'",Yup it still stands
1526812248878219264,2022-05-18 06:29:41+00:00,b'@kanzaki_seb @ROVIMAX agreed',seb agreed
1526812237322629120,2022-05-18 06:29:38+00:00,b'Forward step up on chair. Pak! Nakakapanginig ng legs\xf0\x9f\x98\x9c \n\n#PilatesIsLove #AnteFElates #HealthIsWealth #SweatMalu #SusCOREyosep #CoreStrengthening #Flexibility #LoveYourSpine @ Options Studio - Timog https://t.co/LD3YOsRDtC',Forward step up on chair Pak Nakakapanginig ng legs PilatesIsLove AnteFElates HealthIsWealth SweatMalu SusCOREyosep CoreStrengthening Flexibility LoveYourSpine Options Studio Timog
