id,created_at,text - utf-8,simplified
1526804681057800192,2022-05-18 05:59:37+00:00,"b'i want lambing, not away'",i want lambing not away
1526804677412548608,2022-05-18 05:59:36+00:00,b'Street Fashion\xf0\x9f\x98\x8e\xf0\x9f\x8c\xb2\xf0\x9f\x93\xb8\xf0\x9f\x87\xb5\xf0\x9f\x87\xad#baguioparade #sabaguio #baguiocitytweets https://t.co/pVRSUD7g3E',Street Fashion baguioparade sabaguio baguiocitytweets
1526804675067973634,2022-05-18 05:59:35+00:00,b'@KyleDanvers_ @ColdZero29 Sana all haha',Sana all haha
1526804641517711360,2022-05-18 05:59:27+00:00,b'Babalik na kaya talaga si Ms. @annecurtissmith? Or guest lang muna dahil my concert. #ShowtimeFunnyFunny',Babalik na kaya talaga si Ms Or guest lang muna dahil my concert ShowtimeFunnyFunny
1526804623192756224,2022-05-18 05:59:23+00:00,b'@petruspaolus Congratulations! \xf0\x9f\xa5\xb3',Congratulations
1526804616951713792,2022-05-18 05:59:21+00:00,b'@tineeleyy Photographer ate na may dslr Sana Naman HAHAHAHA',Photographer ate na may dslr Sana Naman HAHAHAHA
1526804614733271040,2022-05-18 05:59:21+00:00,b'@_rechelle07 Abrazos dearest ms. Joanna',rechelle07 Abrazos dearest ms Joanna
1526804584907218944,2022-05-18 05:59:14+00:00,b'hhahahhahaahah https://t.co/n5XtCmK68Q',hhahahhahaahah
1526804569027579904,2022-05-18 05:59:10+00:00,"b""can't the future just wait""",can t the future just wait
1526804550857986048,2022-05-18 05:59:06+00:00,"b'lavarn (@ Nueva Caceres Technology Solutions, Inc. in Naga) https://t.co/Qmu9S7tt0T'",lavarn Nueva Caceres Technology Solutions Inc in Naga
1526804536265822211,2022-05-18 05:59:02+00:00,"b""King Of My Heart, This Is Why We Can't Have Nice Things https://t.co/vOClaeMUfN""",King Of My Heart This Is Why We Can t Have Nice Things
1526804524253401089,2022-05-18 05:58:59+00:00,b'@danatugade Anong oras nyan dito?',Anong oras nyan dito
1526804522248458242,2022-05-18 05:58:59+00:00,"b""@greysonchance 'Coz u so pretty.""",Coz u so pretty
1526804520793088000,2022-05-18 05:58:59+00:00,b'Bakit anggara\xf0\x9f\x98\xa5',Bakit anggara
1526804510165049344,2022-05-18 05:58:56+00:00,b'This tanning obsession is costing me a spleen and a kidney',This tanning obsession is costing me a spleen and a kidney
1526804509787561984,2022-05-18 05:58:56+00:00,b'@MARVIN_0224 Yassssss!!!',0224 Yassssss
1526804493471719424,2022-05-18 05:58:52+00:00,b'kagutom talaga pag naulan e',kagutom talaga pag naulan e
1526804484047142912,2022-05-18 05:58:50+00:00,b'Yeee! Taas sahod na bi\xe2\x98\xba\xef\xb8\x8f',Yeee Taas sahod na bi
1526804460907167744,2022-05-18 05:58:44+00:00,b'Mahal na mahal kita grump!!!!!!!!!!!!!!!!!',Mahal na mahal kita grump
1526804452505956352,2022-05-18 05:58:42+00:00,b'@ByaheroMarcus Halaga pa pala',Halaga pa pala
1526804444993597441,2022-05-18 05:58:40+00:00,b'@chrstphr_chan Trolls  na mga pulawan',chan Trolls na mga pulawan
1526804440942260224,2022-05-18 05:58:40+00:00,b'maumay kayo sa tiktok ko na sunod sunod HAHAHA',maumay kayo sa tiktok ko na sunod sunod HAHAHA
1526804397715759104,2022-05-18 05:58:29+00:00,b'sabi ko linis lang injector gagawin eh. lagay ng 1300 lamang babayaran. bat pag punta ko sa yamaha 2050 na babayaran ko \xf0\x9f\xa5\xb9\xf0\x9f\xa5\xb9\xf0\x9f\xa5\xb9 https://t.co/lQCjEbcxmI',sabi ko linis lang injector gagawin eh lagay ng 1300 lamang babayaran bat pag punta ko sa yamaha 2050 na babayaran ko
1526804363900903424,2022-05-18 05:58:21+00:00,"b'Gabbi to Maine, Tara na! \xe2\x98\xba\xef\xb8\x8f\xf0\x9f\xa4\xa3 \n#MaineMendoza \n@mainedcm'",Gabbi to Maine Tara na MaineMendoza
1526804344946888704,2022-05-18 05:58:17+00:00,"b'Puro work nalang, parang I need a break hahaha\xf0\x9f\xa4\xa3 saan ba pwede? \xf0\x9f\x99\x84'",Puro work nalang parang I need a break hahaha saan ba pwede
1526804336763756546,2022-05-18 05:58:15+00:00,b'Huhu https://t.co/0S56NbmBvQ',Huhu
1526804309924454400,2022-05-18 05:58:08+00:00,"b'@doansnvm Yes po, abang na lang po sa announcement kung kelan mismong open ng store. Budol same with Megamall  \xf0\x9f\x98\x85\xf0\x9f\xa4\xa3'",Yes po abang na lang po sa announcement kung kelan mismong open ng store Budol same with Megamall
1526804308624576512,2022-05-18 05:58:08+00:00,b'HAHAHAHAHAHA hays nalingaw naman ako sa nabal an ko ah di bala sige report saakun traydor ka imo sa partner mo \xf0\x9f\x98\x82\xf0\x9f\xa5\xb4',HAHAHAHAHAHA hays nalingaw naman ako sa nabal an ko ah di bala sige report saakun traydor ka imo sa partner mo
1526804300789608448,2022-05-18 05:58:06+00:00,b'Isang cutie nalang talaga Lord \xf0\x9f\xa5\xb3',Isang cutie nalang talaga Lord
1526804292379611136,2022-05-18 05:58:04+00:00,b'@timivanmarquis1 owww',owww
1526804283160612864,2022-05-18 05:58:02+00:00,b'@chrstphr_chan Hindi po.',chan Hindi po
1526804259072638977,2022-05-18 05:57:56+00:00,"b'I\'ma like "" Cause you\'re hot then you\'re cold\nYou\'re yes then you\'re no\nYou\'re in then you\'re out "" type of person lol.\xf0\x9f\xa5\xb4'",I ma like Cause you re hot then you re cold You re yes then you re no You re in then you re out type of person lol
1526804243880939521,2022-05-18 05:57:53+00:00,b'I hate you all haha',I hate you all haha
1526804223580549120,2022-05-18 05:57:48+00:00,"b""Who's here? \xf0\x9f\x93\x8dSM AURA\n#altertarlac \n#altertaguig https://t.co/WJXISSVMmB""",Who s here SM AURA altertarlac altertaguig
1526804220317691914,2022-05-18 05:57:47+00:00,b'puno ng priv tl ko wtf\xf0\x9f\x98\xad',puno ng priv tl ko wtf
1526804217817886720,2022-05-18 05:57:46+00:00,b'Tapos na ang pila guys!',Tapos na ang pila guys
1526804205645664256,2022-05-18 05:57:43+00:00,b'Next time kasama ka na Kiddy. Nahiya ako magpapic nung blockscreening eh HAHAHAHAHA https://t.co/e8bAj3PbRN',Next time kasama ka na Kiddy Nahiya ako magpapic nung blockscreening eh HAHAHAHAHA
1526804181079629825,2022-05-18 05:57:38+00:00,b'Galing talaga pag Zoom yung orientation eh. Pwede mag attend ng morning session kahit di pa naliligo. \xf0\x9f\xa5\xb2',Galing talaga pag Zoom yung orientation eh Pwede mag attend ng morning session kahit di pa naliligo
1526804179507113986,2022-05-18 05:57:37+00:00,b'Andito ba yung nagviral na nagjaks sa Mu\xc3\xb1oz busway? Haha',Andito ba yung nagviral na nagjaks sa Mu oz busway Haha
1526804162121412608,2022-05-18 05:57:33+00:00,b'mukhang maligno lang si kuya e https://t.co/Wheg79pDGb',mukhang maligno lang si kuya e
1526804158681976833,2022-05-18 05:57:32+00:00,b'@jagimebz_ HAHAHAHA same.',HAHAHAHA same
1526804145721683968,2022-05-18 05:57:29+00:00,b'Kayasa aning watay alam oy',Kayasa aning watay alam oy
1526804144484298752,2022-05-18 05:57:29+00:00,b'powerpuffgurlssss character yarn https://t.co/FanHsXqwKE',powerpuffgurlssss character yarn
1526804143004073984,2022-05-18 05:57:28+00:00,b'@ikatlonghiraya @jedweslee11 HAHAHAHAHAHAHA YEHEY LOL',HAHAHAHAHAHAHA YEHEY LOL
1526804139594125312,2022-05-18 05:57:28+00:00,b'MGA BADING MGA BAKLA https://t.co/unCGjC3JzD',MGA BADING MGA BAKLA
1526804137890877440,2022-05-18 05:57:27+00:00,b'Yay! Lage kong nadadaan store nila sa SM and gustong gusto kong bilhin kaso nagtitipid ako tsaka feel ko di worth it ang pera ko kase ang liit\xf0\x9f\x98\x82 (takaw ate? \xf0\x9f\x98\x82) pero shocks! Mesherep pala mesherep pe sye. HAHAHA maraming salamat sa cake and cheesecake\xf0\x9f\x98\x8d https://t.co/kE7nQMK6v6',Yay Lage kong nadadaan store nila sa SM and gustong gusto kong bilhin kaso nagtitipid ako tsaka feel ko di worth it ang pera ko kase ang liit takaw ate pero shocks Mesherep pala mesherep pe sye HAHAHA maraming salamat sa cake and cheesecake
1526804132748996609,2022-05-18 05:57:26+00:00,"b""people get tired of waiting. that's a fact :/""",people get tired of waiting that s a fact
1526804116554813440,2022-05-18 05:57:22+00:00,b'@mara_janeen why naman loviee koo:(',janeen why naman loviee koo
1526804103573123072,2022-05-18 05:57:19+00:00,b'grabe yung wed ngayon tapos hapon na naman hhahah ambilis',grabe yung wed ngayon tapos hapon na naman hhahah ambilis
1526804102276972544,2022-05-18 05:57:19+00:00,"b'""Salamat sa Panginoon sa pagbibigay sa atin sa isa\'t isa.""\n\n\xf0\x9f\xa5\xb9\xf0\x9f\xab\xb6\xf0\x9f\x8f\xbb'",Salamat sa Panginoon sa pagbibigay sa atin sa isa t isa
1526804086711910401,2022-05-18 05:57:15+00:00,b'@macxvalentine Same.\xf0\x9f\x98\x85',Same
1526804080684765184,2022-05-18 05:57:14+00:00,"b""Not because you lose, you're lost. https://t.co/9QOJizBLSZ""",Not because you lose you re lost
1526804080559271937,2022-05-18 05:57:14+00:00,"b""Today's #WildWednesday PROMO FOR ALL TWIN MASSAGE. That's #DeltaMassage and #KappaDeltaMassage (Blindfold Twin) how to avail? Retweet this post and show it to our recept! UNLIMITED WET AREA 1PM-1AM! More reasons to go today! LET'S JOIN THE WEDNESDAY GROUP! \xf0\x9f\x94\xa5 https://t.co/NS2p1oysCC""",Today s WildWednesday PROMO FOR ALL TWIN MASSAGE That s DeltaMassage and KappaDeltaMassage Blindfold Twin how to avail Retweet this post and show it to our recept UNLIMITED WET AREA 1PM 1AM More reasons to go today LET S JOIN THE WEDNESDAY GROUP
1526804076763152384,2022-05-18 05:57:13+00:00,"b""I'm at Liam's Lomi in Lipa City, Batangas https://t.co/7QMCZ4rbfi https://t.co/F2XuSNJ85n""",I m at Liam s Lomi in Lipa City Batangas
1526804076759236608,2022-05-18 05:57:13+00:00,"b'buti pa yung motor, pogi. hays https://t.co/m7Lc8MBIVY'",buti pa yung motor pogi hays
1526804059906158592,2022-05-18 05:57:09+00:00,b'@PatrickYoung588 Hello sir have a good day \xf0\x9f\x98\x8a',Hello sir have a good day
1526804059054755840,2022-05-18 05:57:08+00:00,b'Elder scrolls secret ingredient. \xf0\x9f\x98\x82\xf0\x9f\x98\x82 https://t.co/dTWFXPzpw0',Elder scrolls secret ingredient
1526804036044828672,2022-05-18 05:57:03+00:00,b'Coffee in the sky.\xf0\x9f\x98\x8a https://t.co/BnP0a8wul3',Coffee in the sky
1526804030621593601,2022-05-18 05:57:02+00:00,b'@mhayamhayaaa Happy Birthday',Happy Birthday
1526804006776885248,2022-05-18 05:56:56+00:00,b'Nagpabudol na nga \xf0\x9f\x98\x82\xf0\x9f\x98\x82\n\n#BTSCOMEBACK2022 #BTSProof #bts https://t.co/A6GG7PRZtq',Nagpabudol na nga BTSCOMEBACK2022 BTSProof bts
1526804002452930560,2022-05-18 05:56:55+00:00,b'tangena. nagulat ako sa presyo ng bola sa yamaha \xf0\x9f\xa5\xb9\xf0\x9f\xa5\xb9 300+ lang yun dati e bat 510 na ngayon? \xf0\x9f\x98\xad',tangena nagulat ako sa presyo ng bola sa yamaha 300 lang yun dati e bat 510 na ngayon
1526803999294230533,2022-05-18 05:56:54+00:00,"b'@ZyraVDio thank you, zyra! \xf0\x9f\x92\x99'",thank you zyra
1526803996236599296,2022-05-18 05:56:54+00:00,b'@Rajaa_Ginting @UnionCoinXRPL Done',Ginting Done
1526803985109159936,2022-05-18 05:56:51+00:00,b'grabe kaba ko parang sasabog HAHAHAHA',grabe kaba ko parang sasabog HAHAHAHA
1526803984882683905,2022-05-18 05:56:51+00:00,b'@kolsenertito Hired! \xe2\x9d\xa4\xef\xb8\x8f\xf0\x9f\x8c\xb8\xf0\x9f\x98\x89\xf0\x9f\x98\x81',Hired
1526803983062671361,2022-05-18 05:56:50+00:00,b'Comprehension mga bhie. Walang hack naganap. \xf0\x9f\x99\x82 https://t.co/9NzNkj5ciP',Comprehension mga bhie Walang hack naganap
1526803980650946560,2022-05-18 05:56:50+00:00,b'@maIanaphies Season 9 because of so much hype for Valentina',Season 9 because of so much hype for Valentina
1526803971431493633,2022-05-18 05:56:48+00:00,"b'@alt_solicitor Teach me your ways, master! \xf0\x9f\xa4\xa3'",solicitor Teach me your ways master
1526803957732913152,2022-05-18 05:56:44+00:00,b'@Im_karlitoo (2)',karlitoo 2
1526803951344943104,2022-05-18 05:56:43+00:00,b'@jjbslo18 aguy.. makig taban naman ni cya oyy..hahaha\xf0\x9f\xa4\xa3',aguy makig taban naman ni cya oyy hahaha
1526803946395774976,2022-05-18 05:56:42+00:00,"b'@mnldana_ Thank you, baks! \xe2\x9d\xa4\xef\xb8\x8f'",Thank you baks
1526803939366424576,2022-05-18 05:56:40+00:00,b'@nobitascopy Tyagaan lang tlaga sa pag hahanap ng maayos at normal ng sched haha',Tyagaan lang tlaga sa pag hahanap ng maayos at normal ng sched haha
1526803937495379968,2022-05-18 05:56:40+00:00,b'@BIGASSTIG Nice haircut ah.\xf0\x9f\x98\x81\xf0\x9f\x91\x8d',Nice haircut ah
1526803899101106176,2022-05-18 05:56:30+00:00,b'@pammyat Sino? Hahahahaha me wanna know',Sino Hahahahaha me wanna know
1526803885683527680,2022-05-18 05:56:27+00:00,b'magkatawa man ko sa imong chika sister oy haha',magkatawa man ko sa imong chika sister oy haha
1526803882222817280,2022-05-18 05:56:26+00:00,b'Kalami sa presyo magpadajaw sa tablet. 10k man gjod. \xf0\x9f\xa4\xa6\xf0\x9f\x8f\xbc\xe2\x80\x8d\xe2\x99\x80\xef\xb8\x8f',Kalami sa presyo magpadajaw sa tablet 10k man gjod
1526803876355006464,2022-05-18 05:56:25+00:00,b'@Bluish_Mino @sera_watson4444 @official_yoon_ I subscribed to @Viu_PH just for this\xf0\x9f\x92\x99\xf0\x9f\x92\x99\xf0\x9f\x92\x99\xf0\x9f\x92\x99',Mino watson4444 yoon I subscribed to PH just for this
1526803875231313920,2022-05-18 05:56:25+00:00,b'@kulaspero28 You can try e-konsulta from OVP.',You can try e konsulta from OVP
1526803857413525505,2022-05-18 05:56:20+00:00,b'NW: Fantastic Beasts: The Secret Of Dumbledore',NW Fantastic Beasts The Secret Of Dumbledore
1526803829337247745,2022-05-18 05:56:14+00:00,b'pasar nasad ko \xf0\x9f\xa5\xba I am really blessed jud sa life \xf0\x9f\x98\x87\xe2\x9d\xa4\xef\xb8\x8f lovelife lang gid failure sa life ko \xf0\x9f\xa4\xaa tama ang panahon pero di tama nga tao nag abot HAHAHAHA okay lang di kami pero okay kami that\xe2\x80\x99s maturity \xf0\x9f\xa5\xb4\xf0\x9f\xa4\xaa',pasar nasad ko I am really blessed jud sa life lovelife lang gid failure sa life ko tama ang panahon pero di tama nga tao nag abot HAHAHAHA okay lang di kami pero okay kami that s maturity
1526803823024807936,2022-05-18 05:56:12+00:00,b'Please lord! Let me have this person in my life as long as i lived \xf0\x9f\xa5\xba\xf0\x9f\xa5\xba',Please lord Let me have this person in my life as long as i lived
1526803784193540096,2022-05-18 05:56:03+00:00,b'@Rose12881634 Tama na\xf0\x9f\x98\xad https://t.co/YNUdgPaf9C',Tama na
1526803778422263810,2022-05-18 05:56:02+00:00,"b'Nagadayo nga mangan paksiw, nem worth it met https://t.co/wASeUWEISd'",Nagadayo nga mangan paksiw nem worth it met
1526803778321584128,2022-05-18 05:56:02+00:00,b'Aabsent ako today heheh.',Aabsent ako today heheh
1526803776845193217,2022-05-18 05:56:01+00:00,b'siguro tiktok nalang muna ako huhu',siguro tiktok nalang muna ako huhu
1526803775448842240,2022-05-18 05:56:01+00:00,b'@shutup_bhie \xf0\x9f\x98\xad\xf0\x9f\x98\xad',bhie
1526803747397021697,2022-05-18 05:55:54+00:00,"b'@idrusomething With or without a beard, still a hottie!'",With or without a beard still a hottie
1526803742649360384,2022-05-18 05:55:53+00:00,b'Ngita mig bagets na Top karon. Knsa pwde? 3sum at my place. Bacayan/Talamban area #altercebu #altertalamban',Ngita mig bagets na Top karon Knsa pwde 3sum at my place Bacayan Talamban area altercebu altertalamban
1526803741739204614,2022-05-18 05:55:53+00:00,"b'Sha, jericho, lili with 2d and 2h cramming an event era. \xf0\x9f\x98\x8c'",Sha jericho lili with 2d and 2h cramming an event era
1526803736646979584,2022-05-18 05:55:52+00:00,b'@alt_solicitor Hahahaha nahihiya na tuloy ako tumingin sa kanya \xf0\x9f\x98\x82',solicitor Hahahaha nahihiya na tuloy ako tumingin sa kanya
1526803722961321984,2022-05-18 05:55:48+00:00,"b'Shadow of the day, valentine\xe2\x80\x99s day and in pieces \xe2\x9d\xa4\xef\xb8\x8f\xe2\x9d\xa4\xef\xb8\x8f\xe2\x9d\xa4\xef\xb8\x8f\xe2\x9d\xa4\xef\xb8\x8f\xe2\x9d\xa4\xef\xb8\x8f\xe2\x9d\xa4\xef\xb8\x8f\xe2\x9d\xa4\xef\xb8\x8f https://t.co/nFIGligrCu'",Shadow of the day valentine s day and in pieces
1526803717055709184,2022-05-18 05:55:47+00:00,b'@ikatlonghiraya @jedweslee11 U know the magical word mia hahaha',U know the magical word mia hahaha
1526803700336893952,2022-05-18 05:55:43+00:00,b'Okay ka lang beh?\xf0\x9f\x98\x82\xf0\x9f\x98\xad\xf0\x9f\x98\xad https://t.co/O2RZVyQWnb',Okay ka lang beh
1526803695723495424,2022-05-18 05:55:42+00:00,b'@AlterAngela2022 set na ba hahhahahah',set na ba hahhahahah
1526803679663140866,2022-05-18 05:55:38+00:00,b'@gelig_john @xtreme_asia @xrpl_xtreme @TomMartinFrank1 @Khaiilaaa \n@wixx_kerbie \n@Rajaa_Ginting \n@FavorBlessed5 \n@jano_gives https://t.co/YNWDb412wi',john asia xtreme kerbie Ginting gives
1526803667382583296,2022-05-18 05:55:35+00:00,b'Sorry kasi natapat ka sa version ko na takot nako',Sorry kasi natapat ka sa version ko na takot nako
1526803656271613952,2022-05-18 05:55:32+00:00,b'bro murag wa mn ko ka dum2 ingani ka init ang pinas??? NA STRESS KOOOO',bro murag wa mn ko ka dum2 ingani ka init ang pinas NA STRESS KOOOO
1526803649606717440,2022-05-18 05:55:31+00:00,b'@Aries_431 https://t.co/6CUztntilh',431
1526803635883020288,2022-05-18 05:55:28+00:00,b'First ever season that I watched was Season 7. \xf0\x9f\x98\x81\xf0\x9f\x98\x81\xf0\x9f\x98\x81 https://t.co/UfVrAkbPs3',First ever season that I watched was Season 7
1526803624201814016,2022-05-18 05:55:25+00:00,b'JWUp\xf0\x9f\xa4\x97\xf0\x9f\xa4\x97',JWUp
1526803623417565184,2022-05-18 05:55:25+00:00,b'Di lang jud unta ni bogus',Di lang jud unta ni bogus
1526803617633558528,2022-05-18 05:55:23+00:00,b'Iloveyou!\xf0\x9f\x98\x98\xe2\x9d\xa4 https://t.co/CW74EtnQvI',Iloveyou
1526803610256146432,2022-05-18 05:55:21+00:00,b'Asa diay na adto akoang gi Instapay\xf0\x9f\xa5\xb9',Asa diay na adto akoang gi Instapay
1526803610201657345,2022-05-18 05:55:21+00:00,b'@kervsky Can\xe2\x80\x99t violate my code of conduct. Baka tayo maopis. Haha!',Can t violate my code of conduct Baka tayo maopis Haha
1526803604732284928,2022-05-18 05:55:20+00:00,b'@mariamercci Si topacio na gasul. Haha',Si topacio na gasul Haha
1526803583378739200,2022-05-18 05:55:15+00:00,b'Arrived! https://t.co/a4w2a6oYtn',Arrived
1526803577272168448,2022-05-18 05:55:14+00:00,"b'@bebeJamesz__ @itsmebboi kayong 2, hoy!  \xf0\x9f\xa4\xa3\xf0\x9f\xa4\xa3\xf0\x9f\xa4\xa3 ang dami temtem sa mundo lol'",kayong 2 hoy ang dami temtem sa mundo lol
1526803576416534528,2022-05-18 05:55:13+00:00,b'mama Neneng \xf0\x9f\xa5\xba',mama Neneng
1526803570749714433,2022-05-18 05:55:12+00:00,b'@frnchsmy Who the fuck are you. Dami mong alam. Ikaw ba yung ex ko ? Sorry. Idont fcking know you',Who the fuck are you Dami mong alam Ikaw ba yung ex ko Sorry Idont fcking know you
1526803569436860416,2022-05-18 05:55:12+00:00,b'@bbqfriess Tama?',Tama
1526803567365214208,2022-05-18 05:55:11+00:00,b'Shuta wala ako maintindihan sa training',Shuta wala ako maintindihan sa training
1526803558204833792,2022-05-18 05:55:09+00:00,b'@__BryanNotBrian Baka he\xe2\x80\x99s being sarcastic or nang aasar lang?',BryanNotBrian Baka he s being sarcastic or nang aasar lang
1526803557223129089,2022-05-18 05:55:09+00:00,"b""I'm at Helen Grace R. Padua Dental Clinic in Naga, Bicol https://t.co/hYxYYUD4Jv""",I m at Helen Grace R Padua Dental Clinic in Naga Bicol
1526803553637273600,2022-05-18 05:55:08+00:00,b'Its not pretty obvious that im so obsessed with this guy huh hahaha \xf0\x9f\x99\x88\xf0\x9f\xa5\xba\xf0\x9f\x98\x8d @kit_connor \n#KitConnor https://t.co/QV7CryXU3i',Its not pretty obvious that im so obsessed with this guy huh hahaha connor KitConnor
1526803529335455744,2022-05-18 05:55:02+00:00,b'tf gusto ko talaga non!!\xf0\x9f\x98\xab\xf0\x9f\x98\xab',tf gusto ko talaga non
1526803520007335936,2022-05-18 05:55:00+00:00,b'Sorry! Kasi natapat ka sa version ko na hindi na ulit isasantabi ang mga goals at priorities ko para lang sa taong mahal ko',Sorry Kasi natapat ka sa version ko na hindi na ulit isasantabi ang mga goals at priorities ko para lang sa taong mahal ko
1526803519684358144,2022-05-18 05:55:00+00:00,b'Vote beomgyu \xf0\x9f\xa7\xb8 https://t.co/UMwUhK8489',Vote beomgyu
1526803510158708737,2022-05-18 05:54:58+00:00,b'whatever https://t.co/hFqZTTnK0x',whatever
1526803494052564993,2022-05-18 05:54:54+00:00,b'@bornAgeek walang ganda na di pinaghihirapan.',walang ganda na di pinaghihirapan
1526803471386628097,2022-05-18 05:54:48+00:00,b'Bakit ganun iisa script https://t.co/bqz70YVo5g',Bakit ganun iisa script
1526803466315673600,2022-05-18 05:54:47+00:00,b'Bayot instinct be like: https://t.co/PX5XMvcAHZ',Bayot instinct be like
1526803463136366592,2022-05-18 05:54:46+00:00,b'@DylWingo @tabakko HAHAHAHAHAHAHA you know I will \xf0\x9f\xa4\xa3',HAHAHAHAHAHAHA you know I will
1526803459756163072,2022-05-18 05:54:46+00:00,b'Cuddle weather\xf0\x9f\xa5\xba',Cuddle weather
1526803441435090945,2022-05-18 05:54:41+00:00,b'Photo Oleo or oil painting colored photos circa 1920 to 1940s at National Museum of Fine Arts\n#photooleo #phototinting #oldphotography #vintageart https://t.co/TwVBMQIuzZ',Photo Oleo or oil painting colored photos circa 1920 to 1940s at National Museum of Fine Arts photooleo phototinting oldphotography vintageart
1526803428508192768,2022-05-18 05:54:38+00:00,b'@prettymfrei SINO',SINO
1526803394509164545,2022-05-18 05:54:30+00:00,b'@Hyperchromer Kaya nga check mo toh https://t.co/oZwF27GfeU',Kaya nga check mo toh
1526803386947244032,2022-05-18 05:54:28+00:00,b'Plssss',Plssss
1526803385038835712,2022-05-18 05:54:28+00:00,"b'Share ko lang, senti tayo ket wala namang pinag huhugutan HAHAHAAHAHAHAH'",Share ko lang senti tayo ket wala namang pinag huhugutan HAHAHAAHAHAHAH
1526803370824339456,2022-05-18 05:54:24+00:00,b'@FleekMr inquiring minds want to know \xf0\x9f\xa4\x94\xf0\x9f\xa4\x94\xf0\x9f\xa4\x94',inquiring minds want to know
1526803359294181376,2022-05-18 05:54:22+00:00,"b'I can afford business class sa totoo lang pero kung tahimik at malinis din naman sa economy class, doon na ako sa mura. Parehas lang naman may upuan na hindi ko naman madadala.'",I can afford business class sa totoo lang pero kung tahimik at malinis din naman sa economy class doon na ako sa mura Parehas lang naman may upuan na hindi ko naman madadala
1526803348615471105,2022-05-18 05:54:19+00:00,b'Yung lalamunan ko talaga pinoproblema ko \xf0\x9f\xa4\xa7 baka sa araw ng presentation wala na me voice \xf0\x9f\x98\xb5',Yung lalamunan ko talaga pinoproblema ko baka sa araw ng presentation wala na me voice
1526803325726773249,2022-05-18 05:54:14+00:00,b'bawal na po ba magtwerk sa tiktok BWAHAHAAHAAHHA https://t.co/hviOVmu5oW',bawal na po ba magtwerk sa tiktok BWAHAHAAHAAHHA
1526803315324989440,2022-05-18 05:54:11+00:00,b'XIAOJUN ACE \xf0\x9f\xa4\xa9 https://t.co/ByixAKNJ1i',XIAOJUN ACE
1526803300456493056,2022-05-18 05:54:08+00:00,b'Food Trip https://t.co/0b2xDQGOED',Food Trip
1526803287827025920,2022-05-18 05:54:05+00:00,b'@gloriaannexxx Pag di kana nagpapabreadtfeed mo kay Z besh tsaka pag lumaki Z makakasabay ka na ket wag na muna yung inom. Yung kwentuhan lang ganern. \xe2\x9d\xa4\xef\xb8\x8f',Pag di kana nagpapabreadtfeed mo kay Z besh tsaka pag lumaki Z makakasabay ka na ket wag na muna yung inom Yung kwentuhan lang ganern
1526803283523710976,2022-05-18 05:54:04+00:00,b'@DRAGONxFCX @GabUndertaker @xloyality_Army @pancky19 @PaydayFriday589 @wixx_kerbie \n@Khaiilaaa \n@PascuaLeoncio \n@einrolf16 \n@FavorBlessed5',Army kerbie
1526803268998791168,2022-05-18 05:54:00+00:00,b'Nakakaiyak palang umuwi ng bulacan hahahahahaha pucha!',Nakakaiyak palang umuwi ng bulacan hahahahahaha pucha
1526803255845879808,2022-05-18 05:53:57+00:00,b'@bebeJamesz__ @itsmebboi tigilan na yan \xf0\x9f\x99\x84\xf0\x9f\x99\x84\xf0\x9f\x99\x84 hahaha char',tigilan na yan hahaha char
1526803251630579712,2022-05-18 05:53:56+00:00,b'@zzzrisyel Nag lupad na?',Nag lupad na
1526803251429261312,2022-05-18 05:53:56+00:00,b'6W3D \xf0\x9f\xab\xb6\xf0\x9f\x8f\xbb',6W3D
1526803234395828225,2022-05-18 05:53:52+00:00,b'Makakakaen ulit ako ng gulay habang nasa apt. https://t.co/1ccACCC4fn',Makakakaen ulit ako ng gulay habang nasa apt
1526803224656719872,2022-05-18 05:53:50+00:00,b'Still wanna play but so tired\xf0\x9f\x99\x83',Still wanna play but so tired
1526803224120168448,2022-05-18 05:53:49+00:00,"b'@PNP_NCRPO @pioncrpoWeCare @rmfbF5pcr Ano!? Wag mag armas? Paano ako makakabuo Ng Anak Kung Wala ako Nyan? At paano maliligayahan ang Mga Kababaehan, Kung Wala ako Nyan? Harassment and Fraudment kayo eh. \xf0\x9f\x98\x81-ACA/ @gmanetwork @pnppio @TV5manila @ABSCBNNews @EatBulaga @24OrasGMA @LawBreakingNews @gmanewstv @Sparkle_GMA https://t.co/5MlsyJJE4d'",NCRPO Ano Wag mag armas Paano ako makakabuo Ng Anak Kung Wala ako Nyan At paano maliligayahan ang Mga Kababaehan Kung Wala ako Nyan Harassment and Fraudment kayo eh ACA GMA
1526803218335903745,2022-05-18 05:53:48+00:00,b'Idaan natin sa pikit\n#NewProfilePic https://t.co/wDgzp3bclJ',Idaan natin sa pikit NewProfilePic
1526803211268636675,2022-05-18 05:53:46+00:00,"b'Just posted a photo @ Balanga City, Bataan https://t.co/fOghvTkbym'",Just posted a photo Balanga City Bataan
1526803210371223552,2022-05-18 05:53:46+00:00,b'Paki-manifest naman dear @ohmnanoned. Hehe! \xf0\x9f\x92\x97 https://t.co/mYiSbwn7RN',Paki manifest naman dear Hehe
1526803204477886464,2022-05-18 05:53:45+00:00,b'First day of rehab huhu no pain no gain gid',First day of rehab huhu no pain no gain gid
1526803199725735937,2022-05-18 05:53:44+00:00,b'@redvlvtcakeee Korek. \xf0\x9f\x98\x82',Korek
1526803191550971904,2022-05-18 05:53:42+00:00,b'Mapa tats na gid ko. OMG',Mapa tats na gid ko OMG
1526803171640606722,2022-05-18 05:53:37+00:00,b'@thekenoimperial @gelobeans91 Geminis out here to get me',Geminis out here to get me
1526803168754929664,2022-05-18 05:53:36+00:00,b'@JanMikosss Dito rob?',Dito rob
1526803134932168704,2022-05-18 05:53:28+00:00,b'Excited for my job interview... Hello adulting! https://t.co/baiOR2Zusl',Excited for my job interview Hello adulting
1526803102178762752,2022-05-18 05:53:20+00:00,b'Busog now antok later.\xf0\x9f\xa5\xb4\xf0\x9f\xa4\xaa #lunchbreak https://t.co/ouDofb21KK',Busog now antok later lunchbreak
1526803075625005057,2022-05-18 05:53:14+00:00,"b'study gamay, selpon daghan'",study gamay selpon daghan
1526803068280619008,2022-05-18 05:53:12+00:00,"b'Ganda!!! \xf0\x9f\x98\x8d\n\n#travel #Siargao #surigao #Philippines #good #life #birthday2022 #Sohoton #sohotoncove @ Sohoton Cove Jelly Fish Sanctuary, Surigao Del Norte https://t.co/PBBVNO4nVZ'",Ganda travel Siargao surigao Philippines good life birthday2022 Sohoton sohotoncove Sohoton Cove Jelly Fish Sanctuary Surigao Del Norte
