id,created_at,text - utf-8,simplified
1526823458750930944,2022-05-18 07:14:14+00:00,b'GUSTO NA KITA SUMBUTAN PERO CHILL LANG.HAHAHA SAKA NA PAGKAHARAP NA KITA.',GUSTO NA KITA SUMBUTAN PERO CHILL LANG HAHAHA SAKA NA PAGKAHARAP NA KITA
1526823455596785664,2022-05-18 07:14:13+00:00,b'hoy kabaho sa posting sa tienda heneral na page. hu u',hoy kabaho sa posting sa tienda heneral na page hu u
1526823447510233089,2022-05-18 07:14:11+00:00,b'@PJACaytonPhD Right? Sparked a kitchen revolution! Hahaha',Right Sparked a kitchen revolution Hahaha
1526823443978928128,2022-05-18 07:14:10+00:00,b'@mendozabryn Bakugo?',Bakugo
1526823440488878081,2022-05-18 07:14:09+00:00,b'Gikapoy na ko aning graduate school hahahahuhuhu',Gikapoy na ko aning graduate school hahahahuhuhu
1526823425607512064,2022-05-18 07:14:06+00:00,b'DSMOM CUTIEEEEE',DSMOM CUTIEEEEE
1526823389708443648,2022-05-18 07:13:57+00:00,b'@melbournepogi22 @eiiiiron Kelan ka luluwas Mel?? Haha oh kaya pa housewarming tayo dyan sa bahay mo pag nauwi kami lol hahaha',Kelan ka luluwas Mel Haha oh kaya pa housewarming tayo dyan sa bahay mo pag nauwi kami lol hahaha
1526823374080851968,2022-05-18 07:13:54+00:00,b'@ManilaEDGER Hindi ko alam if tatanggapin pa nila ID ko heheh. Wala pa ko alum ID \xf0\x9f\x98\x85',Hindi ko alam if tatanggapin pa nila ID ko heheh Wala pa ko alum ID
1526823372524376064,2022-05-18 07:13:53+00:00,b'@ronniee_first HAHAHHAHAHAHAHAHAHHAHAAHHAHA hoiiii',first HAHAHHAHAHAHAHAHAHHAHAAHHAHA hoiiii
1526823367516360704,2022-05-18 07:13:52+00:00,b'It\xe2\x80\x99s a bad idea to open twitter while getting a haircut. \xf0\x9f\x91\x80\xf0\x9f\x92\xa6',It s a bad idea to open twitter while getting a haircut
1526823365297983488,2022-05-18 07:13:51+00:00,b'tanginamu gagu hahaha',tanginamu gagu hahaha
1526823362407723008,2022-05-18 07:13:51+00:00,b'How to reject feelings ng di nakakasakit?',How to reject feelings ng di nakakasakit
1526823344397398016,2022-05-18 07:13:46+00:00,"b'MALA DETECTIVE CONAN AKO EH,BAT BA?'",MALA DETECTIVE CONAN AKO EH BAT BA
1526823324294123520,2022-05-18 07:13:42+00:00,b'for today\xe2\x80\x99s video nindot akung tulog pero may nagtawag kay miss nya nadaw ko HA HA HA HA HA',for today s video nindot akung tulog pero may nagtawag kay miss nya nadaw ko HA HA HA HA HA
1526823320162684928,2022-05-18 07:13:41+00:00,b'bugoa nako oy \xf0\x9f\x98\x94',bugoa nako oy
1526823319441248257,2022-05-18 07:13:41+00:00,b'@PlayMining_SG Hope I win..',SG Hope I win
1526823314102300672,2022-05-18 07:13:39+00:00,b'basta kaslon mao na daw na hahahaha',basta kaslon mao na daw na hahahaha
1526823308393517056,2022-05-18 07:13:38+00:00,b'Baka meron na nga \xf0\x9f\x98\xb6',Baka meron na nga
1526823303351980032,2022-05-18 07:13:37+00:00,b'miss q na aso q',miss q na aso q
1526823301783646208,2022-05-18 07:13:36+00:00,b'@annecurtissmith SHOWTIME is not SHOWTIME without ate ANNE \xf0\x9f\xa5\xb0\xf0\x9f\x98\x8a https://t.co/kj0fTFLvrv',SHOWTIME is not SHOWTIME without ate ANNE
1526823300751818752,2022-05-18 07:13:36+00:00,b'@floydtena Hahahaha tawang tawa akooo',Hahahaha tawang tawa akooo
1526823280283226112,2022-05-18 07:13:31+00:00,"b""10 years ago with mi Italiano. It's been 7 years since I last saw him. Finally spending a month with him in July. Miss this one so bad. He's my home. He has my heart https://t.co/UrVVqVHLQz""",10 years ago with mi Italiano It s been 7 years since I last saw him Finally spending a month with him in July Miss this one so bad He s my home He has my heart
1526823280132227073,2022-05-18 07:13:31+00:00,b'@ohmnanoned Miss ko na kayong lahat! \xf0\x9f\x92\x97',Miss ko na kayong lahat
1526823277930328065,2022-05-18 07:13:31+00:00,b'Excited ako sa sabado kaya lang baka di matuloy.',Excited ako sa sabado kaya lang baka di matuloy
1526823274675523584,2022-05-18 07:13:30+00:00,"b'@jahlligraphy una, wag makipag vc'",una wag makipag vc
1526823273538801665,2022-05-18 07:13:30+00:00,b'Sana may marinig o mabasa akong good news bukas \xf0\x9f\x99\x8f\xf0\x9f\x99\x8f\xf0\x9f\x99\x8f\xe2\x98\x9d\xf0\x9f\x8f\xbc',Sana may marinig o mabasa akong good news bukas
1526823254924660738,2022-05-18 07:13:25+00:00,b'Just posted a photo @ Bohol Beach Club https://t.co/PUc0M8YWZR',Just posted a photo Bohol Beach Club
1526823249593544704,2022-05-18 07:13:24+00:00,b'tumal talaga haha',tumal talaga haha
1526823235874041856,2022-05-18 07:13:21+00:00,b'Tawang tawa ako HAHAHAHAHA https://t.co/y4RN5MRCNf',Tawang tawa ako HAHAHAHAHA
1526823226726555648,2022-05-18 07:13:18+00:00,b'Hay ka kataw anan ba ana nila oy HAHAHAHA ug kabalo lang na among mga uncle ug aunties lol',Hay ka kataw anan ba ana nila oy HAHAHAHA ug kabalo lang na among mga uncle ug aunties lol
1526823214537592832,2022-05-18 07:13:16+00:00,b'sweet naman haha inangyan parang sila lang makakabasa e haha',sweet naman haha inangyan parang sila lang makakabasa e haha
1526823189338148865,2022-05-18 07:13:09+00:00,"b'Yeah , i get. Nag swimming , but the point is need pa bang picturan ? https://t.co/cO0C4OiiyB'",Yeah i get Nag swimming but the point is need pa bang picturan
1526823182564356096,2022-05-18 07:13:08+00:00,b'@FaneyFaney Ay trot ka dyan \xf0\x9f\x98\x82\xf0\x9f\x98\x82\xf0\x9f\x98\x82',Ay trot ka dyan
1526823153304887296,2022-05-18 07:13:01+00:00,"b""geh for the netflix ulet tayo for today's vijow""",geh for the netflix ulet tayo for today s vijow
1526823148997423104,2022-05-18 07:13:00+00:00,b'@AcerPhils The hidden @AcerPhils product is SWIFT!\n\nTagging \n@httpkentell @keunsx @F1GUREHOON\n\n#NextAtAcer #PlanetAcer1 https://t.co/7PPXOIX8jE',The hidden product is SWIFT Tagging NextAtAcer PlanetAcer1
1526823142429446145,2022-05-18 07:12:58+00:00,"b'turo saken ng buhay, maging mabait ka kahit hindi ganon ang turing nila sayo, lagi mong piliin ang umintindi kesa makipagtalo.'",turo saken ng buhay maging mabait ka kahit hindi ganon ang turing nila sayo lagi mong piliin ang umintindi kesa makipagtalo
1526823137492422659,2022-05-18 07:12:57+00:00,b'@alrstr Satru haha nag aaral nako mag YouTube nyan para lang gupitan sarili ko huhu',Satru haha nag aaral nako mag YouTube nyan para lang gupitan sarili ko huhu
1526823132970881024,2022-05-18 07:12:56+00:00,b'Need pa bang picturan? Haha https://t.co/PaaxeKuLZU',Need pa bang picturan Haha
1526823126926929920,2022-05-18 07:12:55+00:00,b'Masaya ako para Kay john. Natupad hiling niya I treat  magulang niya bonus pa na kasama ate niya.',Masaya ako para Kay john Natupad hiling niya I treat magulang niya bonus pa na kasama ate niya
1526823102126358528,2022-05-18 07:12:49+00:00,b'@ScottLEOWarrior @swapleonicorn $Leos $Leon #LeonicornSwap',Leos Leon LeonicornSwap
1526823099756228609,2022-05-18 07:12:48+00:00,b'Bakit pag uwian saka umuulan..\xf0\x9f\x92\xa7\xf0\x9f\x8c\xa7\xe2\x98\x94\xef\xb8\x8f',Bakit pag uwian saka umuulan
1526823097466507264,2022-05-18 07:12:48+00:00,b'@chitaglorya__ @Crypto_GA_Arena https://t.co/cOBh3By3mx',GA Arena
1526823096606289920,2022-05-18 07:12:47+00:00,b'Satu jam tuh cepet banget sih astaga',Satu jam tuh cepet banget sih astaga
1526823094597300225,2022-05-18 07:12:47+00:00,b'@lyka_galsim Hinakot lahat gamit niya sabay labas hahahahahaha \xf0\x9f\xa4\xa3',galsim Hinakot lahat gamit niya sabay labas hahahahahaha
1526823092189732864,2022-05-18 07:12:46+00:00,"b'Melinda Barlis, we get it now. https://t.co/sEl5tgea3e'",Melinda Barlis we get it now
1526823082123530240,2022-05-18 07:12:44+00:00,"b'Just posted a photo @ Manila, Philippines https://t.co/8OjnM9qsTb'",Just posted a photo Manila Philippines
1526823078759567360,2022-05-18 07:12:43+00:00,b'Ang cute ko',Ang cute ko
1526823064444338176,2022-05-18 07:12:40+00:00,b'@jhonfelip_ anong uu',anong uu
1526823057813147648,2022-05-18 07:12:38+00:00,"b'Who else remembers this ad? Kung may pera lang talaga ako nun, matagal ko na to binili! Haha. Yung binalatan ang patatas effortlessly??? https://t.co/TmsuGYqL6k'",Who else remembers this ad Kung may pera lang talaga ako nun matagal ko na to binili Haha Yung binalatan ang patatas effortlessly
1526823056194166785,2022-05-18 07:12:38+00:00,"b'Subscribe na po kayo sa yt page ni Jurno Christian Esguerra. Pramis, nakaka taba ng utak! \xe2\x98\xba\xef\xb8\x8f'",Subscribe na po kayo sa yt page ni Jurno Christian Esguerra Pramis nakaka taba ng utak
1526823018965528576,2022-05-18 07:12:29+00:00,b'Thank you for today \xf0\x9f\xa5\xb0 https://t.co/MXGi9N35rL',Thank you for today
1526823014213427200,2022-05-18 07:12:28+00:00,b'Iba yung trip nang buhay saken \xf0\x9f\x99\x83\xf0\x9f\x98\x87',Iba yung trip nang buhay saken
1526823009830326272,2022-05-18 07:12:27+00:00,b'Inaantok akoooo',Inaantok akoooo
1526823002805260289,2022-05-18 07:12:25+00:00,b'nanguyam man ni engr \xf0\x9f\x98\x82',nanguyam man ni engr
1526822992591745024,2022-05-18 07:12:23+00:00,b'send pusa',send pusa
1526822972203634688,2022-05-18 07:12:18+00:00,b'good luck saila if naa pa silay makaon paghuman kasal HAHAH',good luck saila if naa pa silay makaon paghuman kasal HAHAH
1526822969023922177,2022-05-18 07:12:17+00:00,b'hindi na naman makatulog',hindi na naman makatulog
1526822961562664960,2022-05-18 07:12:15+00:00,b'@ikatlonghiraya @jedweslee11 Hoy apaka oa hahaha may online training me.',Hoy apaka oa hahaha may online training me
1526822944558571520,2022-05-18 07:12:11+00:00,b'Good night fell.',Good night fell
1526822928498987009,2022-05-18 07:12:07+00:00,b'Hahahahahahah nahuli tuloy ako na nakauwi na \xf0\x9f\x98\x82',Hahahahahahah nahuli tuloy ako na nakauwi na
1526822906256191488,2022-05-18 07:12:02+00:00,b'Tagal nung ulan napapaligo na ako e HAHAHA',Tagal nung ulan napapaligo na ako e HAHAHA
1526822905450860544,2022-05-18 07:12:02+00:00,b'@zongcai94 Wag mo sabihin nasa Taguig ka na naman ngayon hahaha',Wag mo sabihin nasa Taguig ka na naman ngayon hahaha
1526822904222339072,2022-05-18 07:12:02+00:00,b'Shutaena. Hahahahaha. Yung comments and quote RTs tho. \xf0\x9f\x98\x82\xf0\x9f\x98\x82 https://t.co/pPEwjYfg6X',Shutaena Hahahahaha Yung comments and quote RTs tho
1526822903131815936,2022-05-18 07:12:01+00:00,b'@claudiopoy Omg para kang may wig???',Omg para kang may wig
1526822871456415745,2022-05-18 07:11:54+00:00,b'@Bang_Garr @CryptoNFTea_ https://t.co/jrAgp8qGgB',Garr
1526822841181609984,2022-05-18 07:11:46+00:00,b'City of Flowers \xf0\x9f\x8c\xba \xf0\x9f\x8c\xb9\xf0\x9f\x8c\xb8\xf0\x9f\x92\x90\xf0\x9f\x8c\xbb\xf0\x9f\x8c\xbc\xf0\x9f\x92\xae https://t.co/de7DWjb8RW',City of Flowers
1526822840854454277,2022-05-18 07:11:46+00:00,b'@windarinat https://t.co/MMcPLtqH8f\n\nMereka ga ada nomor telpon',Mereka ga ada nomor telpon
1526822838417891329,2022-05-18 07:11:46+00:00,b'bili moko nito salamat. @goldiethegold https://t.co/gnsscepuQ8',bili moko nito salamat
1526822833133060096,2022-05-18 07:11:45+00:00,b'Huy madam bat ganyan ka kay doc tricia https://t.co/SY5IhZSKIv',Huy madam bat ganyan ka kay doc tricia
1526822820898308097,2022-05-18 07:11:42+00:00,b'@kylnnhr smahan mo ko kapag nanalo hahaha https://t.co/WngCAqCBOd',smahan mo ko kapag nanalo hahaha
1526822817400233984,2022-05-18 07:11:41+00:00,b'Help! Kids are calling me Tito. I am that old na sa ilaha mata \xf0\x9f\xa5\xb2',Help Kids are calling me Tito I am that old na sa ilaha mata
1526822805589065728,2022-05-18 07:11:38+00:00,b'grabeng pagod\xf0\x9f\x98\xb4',grabeng pagod
1526822802589818881,2022-05-18 07:11:37+00:00,b'sugod naman sa ulan eh',sugod naman sa ulan eh
1526822795396935681,2022-05-18 07:11:36+00:00,b'@CryptoNFTea_ @GameFi_Official @hc_capital @refinableapp @Master_BNB @play2earncrypto @gamefiarmy @PlayToEarnGames Mint now!!!',Official capital BNB Mint now
1526822793622343685,2022-05-18 07:11:35+00:00,b'@alt_ProfessorX With calamansi yan. Less lansa. :)',ProfessorX With calamansi yan Less lansa
1526822788647903232,2022-05-18 07:11:34+00:00,b'kapit tayo ha \xf0\x9f\xa5\xba\xf0\x9f\xa5\xba https://t.co/gsEbx3zJep',kapit tayo ha
1526822774450585600,2022-05-18 07:11:31+00:00,b'Bagaag mga nawng maka demand inganag kwarta sa kasal jusko! Kaluoy sa ginikanan oy!',Bagaag mga nawng maka demand inganag kwarta sa kasal jusko Kaluoy sa ginikanan oy
1526822760147984385,2022-05-18 07:11:27+00:00,b'@jeonjaewonwoo Hahahahaah investement na ah. Ma mahal nana value nila sa ulihi.',Hahahahaah investement na ah Ma mahal nana value nila sa ulihi
1526822757299720192,2022-05-18 07:11:26+00:00,b'Dinadaan nalang sa amat ang nararamdaman',Dinadaan nalang sa amat ang nararamdaman
1526822756804796416,2022-05-18 07:11:26+00:00,"b'Ako lang ba, na sa daming iniisip hindi kana nakakaramdam ng gutom\xf0\x9f\x91\x8d'",Ako lang ba na sa daming iniisip hindi kana nakakaramdam ng gutom
1526822754686644224,2022-05-18 07:11:26+00:00,b'Dami ko work today pero parang mas marami ako nasendan ng memes',Dami ko work today pero parang mas marami ako nasendan ng memes
1526822747069743104,2022-05-18 07:11:24+00:00,b'It\xe2\x80\x99s been gloomy since we arrived. Hoping to see clear skies for sunset before we leave \xf0\x9f\xa5\xb2 https://t.co/zoqAsC9EaD',It s been gloomy since we arrived Hoping to see clear skies for sunset before we leave
1526822743651495937,2022-05-18 07:11:23+00:00,b'@raritygeek @SketchyGeek done https://t.co/rSRrUKjUwC',done
1526822743484006400,2022-05-18 07:11:23+00:00,b'My body needs a salty water \xf0\x9f\x92\xa6\xf0\x9f\x92\xa6 https://t.co/57YOr9Eq6E',My body needs a salty water
1526822737389719552,2022-05-18 07:11:22+00:00,b'Yahaya gyud nako uy \xe2\x9d\xa4\xef\xb8\x8f\xf0\x9f\xa4\xaa https://t.co/yEJNe8I35n',Yahaya gyud nako uy
1526822722986049536,2022-05-18 07:11:18+00:00,b'ka ambisyosa kaayo! HAHAHAHA murag kwartaan jara wa sila ma ulaw?',ka ambisyosa kaayo HAHAHAHA murag kwartaan jara wa sila ma ulaw
1526822700550717440,2022-05-18 07:11:13+00:00,"b'this time, no more halfways &amp; in-betweens. no longer accepting unsure people in my life'",this time no more halfways amp in betweens no longer accepting unsure people in my life
1526822699862880256,2022-05-18 07:11:13+00:00,b'@arhiances sori ha sori\xf0\x9f\x91\x8d',sori ha sori
1526822680766189570,2022-05-18 07:11:08+00:00,b'my babies \xf0\x9f\x98\x8d https://t.co/8NOPDd1Tw2',my babies
1526822677519880192,2022-05-18 07:11:07+00:00,b'@marjo4u Klopt allemaal. Sommige trouwen ook wel. \xf0\x9f\x98\x82\xf0\x9f\x98\x82',Klopt allemaal Sommige trouwen ook wel
1526822670092075008,2022-05-18 07:11:06+00:00,b'g dali dali murag nay gdalian hahahaha ka mga hawd murag nay mga trabaho ka ulaw ana uy',g dali dali murag nay gdalian hahahaha ka mga hawd murag nay mga trabaho ka ulaw ana uy
1526822662789791744,2022-05-18 07:11:04+00:00,b'emback bitches. wala lang. hahahaha! meron na akong time magtwitter ngayon.',emback bitches wala lang hahahaha meron na akong time magtwitter ngayon
1526822638458662912,2022-05-18 07:10:58+00:00,b'papasok nanaman akong wet jusku',papasok nanaman akong wet jusku
1526822638382854144,2022-05-18 07:10:58+00:00,b'This day in 2020: Chubbypoi (with no haircut for months) era. https://t.co/taIBaWTF5L',This day in 2020 Chubbypoi with no haircut for months era
1526822632238088192,2022-05-18 07:10:57+00:00,b'cotton candyyy \xf0\x9f\x98\xad',cotton candyyy
1526822626034798593,2022-05-18 07:10:55+00:00,b'@8potatoooo Dont know how. Kindly google it. \xf0\x9f\x98\x81',Dont know how Kindly google it
1526822623178797056,2022-05-18 07:10:55+00:00,b'shudi demanding kaayo sa kasal murag nay mga dakong abot! Jusko! HAHAHAHA ga salig ras ginikanan! Unsa ba na pagka huna2?',shudi demanding kaayo sa kasal murag nay mga dakong abot Jusko HAHAHAHA ga salig ras ginikanan Unsa ba na pagka huna2
1526822617214164994,2022-05-18 07:10:53+00:00,b'Sana umulan.',Sana umulan
1526822610985619456,2022-05-18 07:10:52+00:00,b'swerte ko sa amo ko\xf0\x9f\x98\x98',swerte ko sa amo ko
1526822601888256000,2022-05-18 07:10:49+00:00,b'@teslaownersSV @ChargeGoGroup DAMN LOVE COLOR PEACH LETS BRING THAT SEXY TESLA TO THE BEACH!! My love \xe2\x9d\xa4\xef\xb8\x8f\xe2\x9d\xa4\xef\xb8\x8f\xe2\x9d\xa4\xef\xb8\x8f @elonmusk',DAMN LOVE COLOR PEACH LETS BRING THAT SEXY TESLA TO THE BEACH My love
1526822574864203778,2022-05-18 07:10:43+00:00,b'@inozanti Hahahah matanda pa sakin yan',Hahahah matanda pa sakin yan
1526822572842569728,2022-05-18 07:10:43+00:00,b'@mikenavallo Sana ito na ang inaantay na plot twist',Sana ito na ang inaantay na plot twist
1526822562004496390,2022-05-18 07:10:40+00:00,b'WAS JUD KO KASAGANG SAIYANG KABAGAG NAWNG HAHAHAHAH',WAS JUD KO KASAGANG SAIYANG KABAGAG NAWNG HAHAHAHAH
1526822540328714241,2022-05-18 07:10:35+00:00,b'tingnan mo uulan nanaman \xf0\x9f\x99\x84',tingnan mo uulan nanaman
1526822532547874816,2022-05-18 07:10:33+00:00,b'Hindi nako maka relate sa kanila',Hindi nako maka relate sa kanila
1526822476424290304,2022-05-18 07:10:20+00:00,b'yes po nakamove on na ako sa eleksyon \xf0\x9f\xa4\xa3\xf0\x9f\x98\xad https://t.co/KxpYmfG6mH',yes po nakamove on na ako sa eleksyon
1526822476080001024,2022-05-18 07:10:19+00:00,b'Ang hirap ng ganito',Ang hirap ng ganito
1526822463920742400,2022-05-18 07:10:17+00:00,b'Basin ganahan kag naay ate unya baby pajud? https://t.co/O2v0lU15E9',Basin ganahan kag naay ate unya baby pajud
1526822443624456192,2022-05-18 07:10:12+00:00,"b'Jusko, sana maka bili na'",Jusko sana maka bili na
1526822443242778624,2022-05-18 07:10:12+00:00,b'@ahjussi44922011 Kalamansi flavor only',Kalamansi flavor only
1526822434728423426,2022-05-18 07:10:10+00:00,b'purya gaba aning handler namo sa HMO',purya gaba aning handler namo sa HMO
1526822430785687552,2022-05-18 07:10:09+00:00,b'@Jha_Bentir30 Goodluck pre\xe2\x98\x9d\xef\xb8\x8f\xf0\x9f\x98\x87',Bentir30 Goodluck pre
1526822430697611264,2022-05-18 07:10:09+00:00,b'@siepsaysitagain Chocotrutcake....\xf0\x9f\x98\x98\xf0\x9f\x98\x98\xf0\x9f\x98\x98',Chocotrutcake
1526822417427210240,2022-05-18 07:10:05+00:00,b'@tps_tropicanas \xf0\x9f\x8c\xb4',tropicanas
1526822405452099584,2022-05-18 07:10:03+00:00,b'I so love this kailangan pa bang picturan  trend. Kakampinks talaga napaka smart. Love you all.',I so love this kailangan pa bang picturan trend Kakampinks talaga napaka smart Love you all
1526822393980674049,2022-05-18 07:10:00+00:00,b'shud i really wear this kind of outfit? \xf0\x9f\xa4\xa3\xf0\x9f\xa4\xa3\xf0\x9f\x98\xad\xf0\x9f\x98\xad https://t.co/yyerweiZnf https://t.co/gHTDboPoJd',shud i really wear this kind of outfit
1526822386158358528,2022-05-18 07:09:58+00:00,b'grumaduate si Jillian with double major from NYU so it\xe2\x80\x99s a major major HAHAHA',grumaduate si Jillian with double major from NYU so it s a major major HAHAHA
1526822377551581184,2022-05-18 07:09:56+00:00,b'Nakita ko lang \xf0\x9f\x98\x82\xf0\x9f\x98\x82\xf0\x9f\x98\x82\xf0\x9f\x98\x82\xf0\x9f\x98\x82 https://t.co/xLEuc91tPq',Nakita ko lang
1526822371549540353,2022-05-18 07:09:55+00:00,"b""Can't be exiled by sadness \xf0\x9f\x91\x8c\xf0\x9f\x8f\xbb https://t.co/Ik5QMfke6m""",Can t be exiled by sadness
1526822371440488448,2022-05-18 07:09:54+00:00,b'Bed weather.. \nWala ba talagang malalandi sa boracay? https://t.co/pgMB31Vqrr',Bed weather Wala ba talagang malalandi sa boracay
1526822355259260928,2022-05-18 07:09:51+00:00,b'Wala tlga ko future sa FPS and fighting games \xf0\x9f\xa4\xa3',Wala tlga ko future sa FPS and fighting games
1526822355145998336,2022-05-18 07:09:51+00:00,"b'Kape sa tag ulan, pero yung malamig \xf0\x9f\x99\x83'",Kape sa tag ulan pero yung malamig
1526822353484668928,2022-05-18 07:09:50+00:00,b'@urnvmbtch @yourselestiaaa Mwah',Mwah
1526822325559042049,2022-05-18 07:09:44+00:00,"b""Travie's Halo-Halo cravings satisfied \xf0\x9f\xa4\xad\xf0\x9f\xa4\xad\xf0\x9f\xa4\xad \n#alterdipolog #alterdapitan https://t.co/IXxeQjfK7j""",Travie s Halo Halo cravings satisfied alterdipolog alterdapitan
1526822292483112960,2022-05-18 07:09:36+00:00,b'@NatsiMe23 true babe \xf0\x9f\xa4\xa1\xf0\x9f\xa4\xa1\xf0\x9f\xa4\xa1',true babe
1526822291132547072,2022-05-18 07:09:35+00:00,b'@dost_pagasa  Tag-julan na po vuhh?!',pagasa Tag julan na po vuhh
1526822285654360066,2022-05-18 07:09:34+00:00,b'Ngaa gna kadlawan nila story ko sa IG mn?? Hahaha',Ngaa gna kadlawan nila story ko sa IG mn Hahaha
1526822280667758592,2022-05-18 07:09:33+00:00,"b'PUTANGINA sobrang payat ko dati parang gago. Ayon nga sa kasabihan, ""Di pa uso vitamins dati."" sheeesh \xf0\x9f\x92\x80 tas yung hairstyle ko?! bwisit na Catholic school yan. double sheesh. https://t.co/TbEn6erOLj'",PUTANGINA sobrang payat ko dati parang gago Ayon nga sa kasabihan Di pa uso vitamins dati sheeesh tas yung hairstyle ko bwisit na Catholic school yan double sheesh
1526822268508045312,2022-05-18 07:09:30+00:00,b'Bahala ka na nga',Bahala ka na nga
1526822268117975047,2022-05-18 07:09:30+00:00,b'@james_pagulayan Iba naman dollll',pagulayan Iba naman dollll
1526822259502919680,2022-05-18 07:09:28+00:00,b'I think UP. Final na. Blocking ni Sotomil very crucial. Chz https://t.co/0MUQxe5kt3',I think UP Final na Blocking ni Sotomil very crucial Chz
1526822259314540544,2022-05-18 07:09:28+00:00,b'JUST IN: Dating Pangulo at returning Pampanga Rep. Gloria Macapagal Arroyo nagpahayag ng suporta kay House Majority Leader Martin Romualdez upang maging susunod na House Speaker. @dwiz882 \n\n\xf0\x9f\x93\xb7: Lakas-CMD https://t.co/ZOmRRHmEi8',JUST IN Dating Pangulo at returning Pampanga Rep Gloria Macapagal Arroyo nagpahayag ng suporta kay House Majority Leader Martin Romualdez upang maging susunod na House Speaker Lakas CMD
1526822251865460736,2022-05-18 07:09:26+00:00,b'Meron ba dito place for fun?\xf0\x9f\xa4\xad\xf0\x9f\xa4\xad\xf0\x9f\xa4\xad\n\nGlorietta2 https://t.co/Z6Q18xG51W',Meron ba dito place for fun Glorietta2
1526822211868209152,2022-05-18 07:09:16+00:00,b'ang hirap mag libang bwct',ang hirap mag libang bwct
1526822203274465280,2022-05-18 07:09:14+00:00,b'@rapid_silence Thankie \xe2\x98\xba\xef\xb8\x8f',silence Thankie
1526822198291312640,2022-05-18 07:09:13+00:00,"b'@IndayMissM DYK: That one of the very 1sr directives given by PRRD during his 1st Cabinet Meeting on June 30, 2016 is to \xe2\x80\x9cCHANGE THE POLICY THAT PRIORITIZES THE PRESIDENTIAL PLANE FOR TAKE-OFFS AND LANDINGS\xe2\x80\x9d, and for the Presidential plane to \xe2\x80\x9cQUEUE IN THE SAME MANNER AS REGULAR FLIGHTS\xe2\x80\x9d? https://t.co/TbtxypMjdt'",DYK That one of the very 1sr directives given by PRRD during his 1st Cabinet Meeting on June 30 2016 is to CHANGE THE POLICY THAT PRIORITIZES THE PRESIDENTIAL PLANE FOR TAKE OFFS AND LANDINGS and for the Presidential plane to QUEUE IN THE SAME MANNER AS REGULAR FLIGHTS
1526822196030496770,2022-05-18 07:09:13+00:00,"b'Hay no midweek breather, I think. \xf0\x9f\xa5\xba'",Hay no midweek breather I think
1526822192499269632,2022-05-18 07:09:12+00:00,b'@nico_montellano Retrieve orig fb acct muna hahaha',montellano Retrieve orig fb acct muna hahaha
1526822186186465280,2022-05-18 07:09:10+00:00,b'Galit na galit naman yung ulaaan',Galit na galit naman yung ulaaan
1526822163525009408,2022-05-18 07:09:05+00:00,b'Hawl awn i look saur skinny here pala \xf0\x9f\xa5\xb0 https://t.co/NdLoavRARK',Hawl awn i look saur skinny here pala
1526822160844484608,2022-05-18 07:09:04+00:00,b'Congrats po @jillrobredo \xf0\x9f\x92\x97\xf0\x9f\x92\x97\xf0\x9f\x92\x97 https://t.co/0k172B8iMM',Congrats po
1526822151524716544,2022-05-18 07:09:02+00:00,b'@Papi_pup2020 Hahahaha \xf0\x9f\x98\x86 yup yup \xf0\x9f\x99\x88\xf0\x9f\x99\x8f\xe2\x9d\xa4\xef\xb8\x8f',pup2020 Hahahaha yup yup
1526822148958224386,2022-05-18 07:09:01+00:00,b'Naka install nlg kog fb ug balik tungod aning ptc \xf0\x9f\xa5\xb4',Naka install nlg kog fb ug balik tungod aning ptc
1526822143601692672,2022-05-18 07:09:00+00:00,"b'@Siwaray_ine @allperez2022 @angelsamson23_ @bongbongmarcos Mas ok na siguro ung ma- ""ACM"" kesa sa amoy sibuyas \xf0\x9f\x99\x84'",ine Mas ok na siguro ung ma ACM kesa sa amoy sibuyas
1526822141835939841,2022-05-18 07:09:00+00:00,b'ang hirap ng sitwasyon nato :&lt;&lt;',ang hirap ng sitwasyon nato lt lt
1526822134508425216,2022-05-18 07:08:58+00:00,b'@theadtan Just think it over yap',Just think it over yap
1526822133816389632,2022-05-18 07:08:58+00:00,b'I feel like this is UP Cebu. https://t.co/qBRemBqAVY',I feel like this is UP Cebu
1526822124119203840,2022-05-18 07:08:56+00:00,b'@EvsInThailand Hahahaha inggit ka na naman charis haha',Hahahaha inggit ka na naman charis haha
1526822119044091904,2022-05-18 07:08:54+00:00,b'@panget05ako aw \xf0\x9f\x98\x8b',aw
1526822115223437312,2022-05-18 07:08:53+00:00,"b'sakit sa part na ""you are my first love but she\'ll be my last, the one to have my last name \xf0\x9f\xa5\xba'",sakit sa part na you are my first love but she ll be my last the one to have my last name
1526822105199038464,2022-05-18 07:08:51+00:00,b'Gagi angas nung mga code',Gagi angas nung mga code
1526822085339025408,2022-05-18 07:08:46+00:00,b'never again',never again
1526822082071261184,2022-05-18 07:08:46+00:00,b'gun-the\xe2\x9d\xa4\xef\xb8\x8f https://t.co/Jo9oGuos3z',gun the
1526822081337638912,2022-05-18 07:08:45+00:00,b'Ay nakakatamad yung weather \xf0\x9f\xa5\xb4 wala akong matapos na gawain',Ay nakakatamad yung weather wala akong matapos na gawain
1526822073242251265,2022-05-18 07:08:43+00:00,b'@omg_its_mikey Oooh! Bakit nga nawala!',its mikey Oooh Bakit nga nawala
1526822069572210688,2022-05-18 07:08:43+00:00,b'WITH HIGH HONORS PO PLS HUHU \xf0\x9f\x98\xad\xf0\x9f\x98\xad\xf0\x9f\x98\xad\xf0\x9f\x98\xad\xf0\x9f\x98\xad SAYANG PO ANG LIGHT STICK PAG WALA AKO SA LIST',WITH HIGH HONORS PO PLS HUHU SAYANG PO ANG LIGHT STICK PAG WALA AKO SA LIST
1526822055491928065,2022-05-18 07:08:39+00:00,b'jail \xf0\x9f\x92\x80\xf0\x9f\x92\x80\xf0\x9f\x92\x80 https://t.co/VYM3a99yrG',jail
1526822046902398976,2022-05-18 07:08:37+00:00,b'yung converge sa tanza kala mo smart broadband basura ampota',yung converge sa tanza kala mo smart broadband basura ampota
1526822035497754625,2022-05-18 07:08:34+00:00,b'ah sge nasab kog kalipong',ah sge nasab kog kalipong
1526822034956644353,2022-05-18 07:08:34+00:00,b'Pagod sa work\xf0\x9f\x98\xa9',Pagod sa work
1526822028325507072,2022-05-18 07:08:33+00:00,b':p',p
